Project;Task;Changed files;TestI;TextI
https://github.com/rapidftr/RapidFTR;990;[app/models/user.rb, features/edit_user_details.feature];[app/controllers/admin_controller.rb, app/controllers/application_controller.rb, app/controllers/child_media_controller.rb, app/controllers/children_controller.rb, app/controllers/form_section_controller.rb, app/controllers/highlight_fields_controller.rb, app/controllers/histories_controller.rb, app/controllers/users_controller.rb, app/models/form_section.rb, app/models/searchable.rb, app/views/admin/index.html.erb, app/views/child_media/manage_photos.html.erb, app/views/children/_audio_player.html.erb, app/views/children/_audio_upload_box.html.erb, app/views/children/_check_boxes.html.erb, app/views/children/_date_field.html.erb, app/views/children/_field_display_audio.html.erb, app/views/children/_field_display_basic.html.erb, app/views/children/_field_display_photo.html.erb, app/views/children/_filter_box.html.erb, app/views/children/_form_section.html.erb, app/views/children/_form_section_info.html.erb, app/views/children/_mark_as.html.erb, app/views/children/_numeric_field.html.erb, app/views/children/_order_by_box.html.erb, app/views/children/_photo_upload_box.html.erb, app/views/children/_picture.html.erb, app/views/children/_radio_button.html.erb, app/views/children/_repeatable_text_field.html.erb, app/views/children/_search_results.html.erb, app/views/children/_select_box.html.erb, app/views/children/_show_child_toolbar.erb, app/views/children/_show_form_section.html.erb, app/views/children/_summary_row.html.erb, app/views/children/_tabs.html.erb, app/views/children/_text_field.html.erb, app/views/children/_textarea.html.erb, app/views/children/edit.html.erb, app/views/children/edit_photo.html.erb, app/views/children/index.html.erb, app/views/children/new.html.erb, app/views/children/search.html.erb, app/views/children/show.html.erb, app/views/children/suspect_records.html.erb, app/views/form_section/index.html.erb, app/views/highlight_fields/index.html.erb, app/views/histories/_audio_history_change.html.erb, app/views/histories/_flag_change.erb, app/views/histories/_history_change.html.erb, app/views/histories/_investigated_change.html.erb, app/views/histories/_photo_history_change.html.erb, app/views/histories/_reunited_change.erb, app/views/histories/show.html.erb, app/views/shared/_form_fields.html.erb, app/views/users/_devices.html.erb, app/views/users/_edittable_user.html.erb, app/views/users/_mobile_login_history.html.erb, app/views/users/_user.html.erb, app/views/users/_user_disabled_checkbox.html.erb, app/views/users/_users_header.html.erb, app/views/users/_users_table.html.erb, app/views/users/edit.html.erb, app/views/users/index.html.erb, app/views/users/new.html.erb];[features/edit_user_details.feature]
https://github.com/rapidftr/RapidFTR;1004;[app/controllers/children_controller.rb, app/views/children/_order_by_box.html.erb, app/views/children/index.html.erb, features/view_child_records.feature, features/step_definitions/basic_steps.rb, app/helpers/children_helper.rb, features/step_definitions/web_steps.rb, public/stylesheets/core.css, app/views/children/_filter_box.html.erb, config/routes.rb];[app/models/child.rb, app/models/session.rb, app/models/user.rb];[app/models/child.rb, features/step_definitions/basic_steps.rb, features/view_child_record_log.feature, spec/controllers/children_controller_spec.rb, spec/models/child_spec.rb]
https://github.com/rapidftr/RapidFTR;1009;[app/views/histories/show.html.erb, features/view_child_record_log.feature, spec/views/histories/show.html.erb_spec.rb, app/models/user.rb, spec/models/user_spec.rb];[app/models/child.rb];[features/view_child_record_log.feature, spec/controllers/children_controller_spec.rb, spec/views/histories/show.html.erb_spec.rb]
https://github.com/rapidftr/RapidFTR;1015;[app/controllers/children_controller.rb, app/models/child.rb, app/views/children/suspect_records.html.erb, app/views/home/index.html.erb, config/routes.rb, features/flag_child_record.feature, features/step_definitions/basic_steps.rb, spec/controllers/children_controller_spec.rb];[app/controllers/child_media_controller.rb, app/controllers/children_controller.rb, app/controllers/form_section_controller.rb, app/controllers/histories_controller.rb, app/models/child.rb, app/models/form_section.rb, app/models/search_service.rb, app/models/searchable.rb, app/views/child_media/manage_photos.html.erb, app/views/children/_audio_player.html.erb, app/views/children/_audio_upload_box.html.erb, app/views/children/_check_boxes.html.erb, app/views/children/_date_field.html.erb, app/views/children/_field_display_audio.html.erb, app/views/children/_field_display_basic.html.erb, app/views/children/_field_display_photo.html.erb, app/views/children/_form_section.html.erb, app/views/children/_form_section_info.html.erb, app/views/children/_mark_as.html.erb, app/views/children/_numeric_field.html.erb, app/views/children/_photo_upload_box.html.erb, app/views/children/_picture.html.erb, app/views/children/_radio_button.html.erb, app/views/children/_repeatable_text_field.html.erb, app/views/children/_search_results.html.erb, app/views/children/_select_box.html.erb, app/views/children/_show_child_toolbar.erb, app/views/children/_show_form_section.html.erb, app/views/children/_summary_row.html.erb, app/views/children/_tabs.html.erb, app/views/children/_text_field.html.erb, app/views/children/_textarea.html.erb, app/views/children/edit.html.erb, app/views/children/edit_photo.html.erb, app/views/children/index.html.erb, app/views/children/new.html.erb, app/views/children/search.html.erb, app/views/children/show.html.erb, app/views/children/suspect_records.html.erb, app/views/histories/_audio_history_change.html.erb, app/views/histories/_flag_change.erb, app/views/histories/_history_change.html.erb, app/views/histories/_photo_history_change.html.erb, app/views/histories/_reunited_change.erb, app/views/histories/show.html.erb];[app/views/histories/show.html.erb, features/step_definitions/basic_steps.rb]
https://github.com/rapidftr/RapidFTR;1019;[app/views/children/_summary_row.html.erb, spec/views/child/_summary_row.html.erb_spec.rb, features/create_child_record.feature];[app/controllers/child_media_controller.rb, app/controllers/children_controller.rb, app/controllers/form_section_controller.rb, app/controllers/histories_controller.rb, app/models/form_section.rb, app/models/session.rb, app/models/user.rb, app/views/child_media/manage_photos.html.erb, app/views/children/_audio_player.html.erb, app/views/children/_audio_upload_box.html.erb, app/views/children/_check_boxes.html.erb, app/views/children/_date_field.html.erb, app/views/children/_field_display_audio.html.erb, app/views/children/_field_display_basic.html.erb, app/views/children/_field_display_photo.html.erb, app/views/children/_form_section.html.erb, app/views/children/_form_section_info.html.erb, app/views/children/_mark_as.html.erb, app/views/children/_numeric_field.html.erb, app/views/children/_photo_upload_box.html.erb, app/views/children/_picture.html.erb, app/views/children/_radio_button.html.erb, app/views/children/_repeatable_text_field.html.erb, app/views/children/_search_results.html.erb, app/views/children/_select_box.html.erb, app/views/children/_show_child_toolbar.erb, app/views/children/_show_form_section.html.erb, app/views/children/_summary_row.html.erb, app/views/children/_tabs.html.erb, app/views/children/_text_field.html.erb, app/views/children/_textarea.html.erb, app/views/children/edit.html.erb, app/views/children/edit_photo.html.erb, app/views/children/index.html.erb, app/views/children/new.html.erb, app/views/children/search.html.erb, app/views/children/show.html.erb, app/views/histories/_audio_history_change.html.erb, app/views/histories/_flag_change.erb, app/views/histories/_history_change.html.erb, app/views/histories/_photo_history_change.html.erb, app/views/histories/_reunited_change.erb, app/views/histories/show.html.erb];[features/create_child_record.feature]
https://github.com/rapidftr/RapidFTR;1036;[app/models/child.rb, spec/models/child_spec.rb, app/views/histories/_photo_history_change.html.erb, app/views/histories/show.html.erb, spec/views/histories/show.html.erb_spec.rb, features/view_child_record_log.feature, lib/rapid_ftr/form_section_setup.rb, lib/tasks/cucumber.rake];[app/models/child.rb];[features/view_child_record_log.feature, spec/views/histories/show.html.erb_spec.rb]
https://github.com/rapidftr/RapidFTR;1039;[app/controllers/advanced_search_controller.rb, app/controllers/children_controller.rb, app/controllers/contact_information_controller.rb, app/controllers/fields_controller.rb, app/controllers/form_section_controller.rb, app/controllers/users_controller.rb, app/views/admin/index.html.erb, app/views/children/index.html.erb, app/views/contact_information/edit.html.erb, app/views/contact_information/show.html.erb, app/views/fields/new.html.erb, app/views/form_section/edit.html.erb, app/views/form_section/index.html.erb, app/views/form_section/new.html.erb, app/views/home/index.html.erb, app/views/layouts/application.html.erb, app/views/users/edit.html.erb, app/views/users/new.html.erb, features/add_custom_field_to_form_section.feature, features/add_suggested_field_to_form_sections.feature, features/child_record_validations.feature, features/create_child_new_disabled_form_section.feature, features/create_child_record.feature, features/create_new_form.feature, features/edit_child_record.feature, features/hide_child_record_form_fields.feature, features/home_page_link.feature, features/manage_forms.feature, features/user_disable.feature, features/view_child_record_log.feature, spec/controllers/fields_controller_spec.rb, spec/controllers/users_controller_spec.rb];[app/controllers/admin_controller.rb, app/controllers/application_controller.rb, app/controllers/child_ids_controller.rb, app/controllers/child_media_controller.rb, app/controllers/children_controller.rb, app/controllers/fields_controller.rb, app/controllers/form_section_controller.rb, app/controllers/highlight_fields_controller.rb, app/controllers/histories_controller.rb, app/controllers/home_controller.rb, app/controllers/password_recovery_requests_controller.rb, app/controllers/publish_form_section_controller.rb, app/controllers/sessions_controller.rb, app/controllers/users_controller.rb, app/models/child.rb, app/models/field.rb, app/models/form_section.rb, app/models/search_service.rb, app/models/searchable.rb, app/models/session.rb, app/models/suggested_field.rb, app/models/summary.rb, app/models/user.rb, app/views/admin/index.html.erb, app/views/children/_audio_player.html.erb, app/views/children/_audio_upload_box.html.erb, app/views/children/_check_boxes.html.erb, app/views/children/_date_field.html.erb, app/views/children/_field_display_audio.html.erb, app/views/children/_field_display_basic.html.erb, app/views/children/_field_display_photo.html.erb, app/views/children/_form_section.html.erb, app/views/children/_form_section_info.html.erb, app/views/children/_mark_as.html.erb, app/views/children/_numeric_field.html.erb, app/views/children/_photo_upload_box.html.erb, app/views/children/_picture.html.erb, app/views/children/_radio_button.html.erb, app/views/children/_repeatable_text_field.html.erb, app/views/children/_search_results.html.erb, app/views/children/_select_box.html.erb, app/views/children/_show_child_toolbar.erb, app/views/children/_show_form_section.html.erb, app/views/children/_summary_row.html.erb, app/views/children/_tabs.html.erb, app/views/children/_text_field.html.erb, app/views/children/_textarea.html.erb, app/views/children/edit.html.erb, app/views/children/edit_photo.html.erb, app/views/children/index.html.erb, app/views/children/new.html.erb, app/views/children/search.html.erb, app/views/children/show.html.erb, app/views/fields/_basic_form.html.erb, app/views/fields/_common.html.erb, app/views/fields/_multiple_choice_form.html.erb, app/views/fields/_suggested_field.html.erb, app/views/fields/choose.html.erb, app/views/fields/edit.html.erb, app/views/fields/new.html.erb, app/views/form_section/index.html.erb, app/views/form_section/new.html.erb, app/views/highlight_fields/index.html.erb, app/views/histories/_audio_history_change.html.erb, app/views/histories/_flag_change.erb, app/views/histories/_history_change.html.erb, app/views/histories/_photo_history_change.html.erb, app/views/histories/_reunited_change.erb, app/views/histories/show.html.erb, app/views/home/_notifications.html.erb, app/views/home/index.html.erb, app/views/password_recovery_requests/create.html.erb, app/views/password_recovery_requests/new.html.erb, app/views/sessions/new.html.erb, app/views/sessions/show.html.erb, app/views/shared/_form_fields.html.erb, app/views/users/_devices.html.erb, app/views/users/_edittable_user.html.erb, app/views/users/_mobile_login_history.html.erb, app/views/users/edit.html.erb, app/views/users/index.html.erb, app/views/users/new.html.erb, app/views/users/show.html.erb];[app/controllers/fields_controller.rb, features/add_custom_field_to_form_section.feature]
https://github.com/rapidftr/RapidFTR;1041;[app/models/child.rb, app/views/histories/_photo_history_change.html.erb, app/views/histories/show.html.erb, spec/models/child_spec.rb, spec/views/histories/show.html.erb_spec.rb, features/view_child_record_log.feature];[app/models/child.rb];[features/view_child_record_log.feature, spec/controllers/children_controller_spec.rb]
https://github.com/rapidftr/RapidFTR;1051;[app/models/child.rb, features/edit_child_record.feature];[app/controllers/child_media_controller.rb, app/controllers/children_controller.rb, app/controllers/form_section_controller.rb, app/controllers/histories_controller.rb, app/models/form_section.rb, app/models/session.rb, app/models/user.rb, app/views/children/_audio_player.html.erb, app/views/children/_audio_upload_box.html.erb, app/views/children/_check_boxes.html.erb, app/views/children/_date_field.html.erb, app/views/children/_field_display_audio.html.erb, app/views/children/_field_display_basic.html.erb, app/views/children/_field_display_photo.html.erb, app/views/children/_form_section.html.erb, app/views/children/_form_section_info.html.erb, app/views/children/_mark_as.html.erb, app/views/children/_numeric_field.html.erb, app/views/children/_photo_upload_box.html.erb, app/views/children/_picture.html.erb, app/views/children/_radio_button.html.erb, app/views/children/_repeatable_text_field.html.erb, app/views/children/_search_results.html.erb, app/views/children/_select_box.html.erb, app/views/children/_show_child_toolbar.erb, app/views/children/_show_form_section.html.erb, app/views/children/_summary_row.html.erb, app/views/children/_tabs.html.erb, app/views/children/_text_field.html.erb, app/views/children/_textarea.html.erb, app/views/children/edit.html.erb, app/views/children/edit_photo.html.erb, app/views/children/index.html.erb, app/views/children/new.html.erb, app/views/children/search.html.erb, app/views/children/show.html.erb, app/views/histories/_audio_history_change.html.erb, app/views/histories/_flag_change.erb, app/views/histories/_history_change.html.erb, app/views/histories/_photo_history_change.html.erb, app/views/histories/_reunited_change.erb, app/views/histories/show.html.erb];[features/create_child_record.feature, features/edit_child_record.feature]
https://github.com/rapidftr/RapidFTR;1054;[app/views/fields/_common.html.erb, app/views/form_section/edit.html.erb, app/views/form_section/new.html.erb, features/add_custom_field_to_form_section.feature, features/create_new_form.feature, features/edit_custom_fields.feature, features/edit_form_section.feature];[app/controllers/admin_controller.rb, app/controllers/application_controller.rb, app/controllers/child_ids_controller.rb, app/controllers/child_media_controller.rb, app/controllers/children_controller.rb, app/controllers/fields_controller.rb, app/controllers/form_section_controller.rb, app/controllers/highlight_fields_controller.rb, app/controllers/histories_controller.rb, app/controllers/publish_form_section_controller.rb, app/controllers/sessions_controller.rb, app/controllers/users_controller.rb, app/models/child.rb, app/models/field.rb, app/models/form_section.rb, app/models/searchable.rb, app/models/summary.rb, app/models/user.rb, app/views/admin/index.html.erb, app/views/children/_audio_player.html.erb, app/views/children/_audio_upload_box.html.erb, app/views/children/_check_boxes.html.erb, app/views/children/_date_field.html.erb, app/views/children/_field_display_audio.html.erb, app/views/children/_field_display_basic.html.erb, app/views/children/_field_display_photo.html.erb, app/views/children/_form_section.html.erb, app/views/children/_form_section_info.html.erb, app/views/children/_mark_as.html.erb, app/views/children/_numeric_field.html.erb, app/views/children/_photo_upload_box.html.erb, app/views/children/_picture.html.erb, app/views/children/_radio_button.html.erb, app/views/children/_repeatable_text_field.html.erb, app/views/children/_search_results.html.erb, app/views/children/_select_box.html.erb, app/views/children/_show_child_toolbar.erb, app/views/children/_show_form_section.html.erb, app/views/children/_summary_row.html.erb, app/views/children/_tabs.html.erb, app/views/children/_text_field.html.erb, app/views/children/_textarea.html.erb, app/views/children/edit.html.erb, app/views/children/edit_photo.html.erb, app/views/children/index.html.erb, app/views/children/new.html.erb, app/views/children/search.html.erb, app/views/children/show.html.erb, app/views/fields/_basic_form.html.erb, app/views/fields/_common.html.erb, app/views/fields/_multiple_choice_form.html.erb, app/views/fields/_suggested_field.html.erb, app/views/fields/choose.html.erb, app/views/fields/edit.html.erb, app/views/fields/new.html.erb, app/views/form_section/index.html.erb, app/views/form_section/new.html.erb, app/views/highlight_fields/index.html.erb, app/views/histories/_audio_history_change.html.erb, app/views/histories/_flag_change.erb, app/views/histories/_history_change.html.erb, app/views/histories/_photo_history_change.html.erb, app/views/histories/_reunited_change.erb, app/views/histories/show.html.erb, app/views/sessions/new.html.erb, app/views/sessions/show.html.erb, app/views/shared/_form_fields.html.erb, app/views/users/_devices.html.erb, app/views/users/_edittable_user.html.erb, app/views/users/_mobile_login_history.html.erb, app/views/users/edit.html.erb, app/views/users/index.html.erb, app/views/users/new.html.erb];[features/add_custom_field_to_form_section.feature]
https://github.com/rapidftr/RapidFTR;1058;[app/views/children/_mark_as.html.erb, app/views/children/_show_child_toolbar.erb, app/views/children/show.html.erb, capybara_features/step_definitions/child_record_toolbar_steps.rb, capybara_features/step_definitions/children_setup_steps.rb, capybara_features/view_child_record_toolbar.feature, features/step_definitions/basic_steps.rb, public/images/icon-reunited.gif, public/stylesheets/core.css, app/helpers/children_helper.rb, public/images/reunited-bkg.jpg, features/hide_child_record_form_fields.feature, lib/pdf_generator.rb];[app/controllers/child_media_controller.rb, app/controllers/children_controller.rb, app/controllers/form_section_controller.rb, app/controllers/histories_controller.rb, app/controllers/sessions_controller.rb, app/controllers/users_controller.rb, app/models/field.rb, app/models/form_section.rb, app/views/children/_audio_player.html.erb, app/views/children/_audio_upload_box.html.erb, app/views/children/_check_boxes.html.erb, app/views/children/_date_field.html.erb, app/views/children/_field_display_audio.html.erb, app/views/children/_field_display_basic.html.erb, app/views/children/_field_display_photo.html.erb, app/views/children/_form_section.html.erb, app/views/children/_form_section_info.html.erb, app/views/children/_mark_as.html.erb, app/views/children/_numeric_field.html.erb, app/views/children/_photo_upload_box.html.erb, app/views/children/_picture.html.erb, app/views/children/_radio_button.html.erb, app/views/children/_repeatable_text_field.html.erb, app/views/children/_search_results.html.erb, app/views/children/_select_box.html.erb, app/views/children/_show_child_toolbar.erb, app/views/children/_show_form_section.html.erb, app/views/children/_summary_row.html.erb, app/views/children/_tabs.html.erb, app/views/children/_text_field.html.erb, app/views/children/_textarea.html.erb, app/views/children/edit.html.erb, app/views/children/edit_photo.html.erb, app/views/children/index.html.erb, app/views/children/new.html.erb, app/views/children/search.html.erb, app/views/children/show.html.erb, app/views/histories/_audio_history_change.html.erb, app/views/histories/_flag_change.erb, app/views/histories/_history_change.html.erb, app/views/histories/_photo_history_change.html.erb, app/views/histories/_reunited_change.erb, app/views/histories/show.html.erb];[features/add_custom_field_to_form_section.feature]
https://github.com/rapidftr/RapidFTR;1068;[app/views/children/_show_child_toolbar.erb, features/reunite_child_record.feature, features/step_definitions/basic_steps.rb, app/helpers/histories_helper.rb, app/models/child.rb, app/views/histories/_flag_change.erb, app/views/histories/_reunited_change.erb, app/views/histories/show.html.erb, spec/helpers/histories_helper_spec.rb, spec/models/child_spec.rb, app/views/children/_mark_as.html.erb, app/views/children/show.html.erb, app/controllers/admin_controller.rb, public/stylesheets/core.css];[app/controllers/child_media_controller.rb, app/controllers/children_controller.rb, app/controllers/form_section_controller.rb, app/controllers/histories_controller.rb, app/models/child.rb, app/models/form_section.rb, app/models/searchable.rb, app/views/children/_audio_player.html.erb, app/views/children/_audio_upload_box.html.erb, app/views/children/_check_boxes.html.erb, app/views/children/_date_field.html.erb, app/views/children/_field_display_audio.html.erb, app/views/children/_field_display_basic.html.erb, app/views/children/_field_display_photo.html.erb, app/views/children/_form_section.html.erb, app/views/children/_form_section_info.html.erb, app/views/children/_mark_as.html.erb, app/views/children/_numeric_field.html.erb, app/views/children/_photo_upload_box.html.erb, app/views/children/_picture.html.erb, app/views/children/_radio_button.html.erb, app/views/children/_repeatable_text_field.html.erb, app/views/children/_search_results.html.erb, app/views/children/_select_box.html.erb, app/views/children/_show_child_toolbar.erb, app/views/children/_show_form_section.html.erb, app/views/children/_summary_row.html.erb, app/views/children/_tabs.html.erb, app/views/children/_text_field.html.erb, app/views/children/_textarea.html.erb, app/views/children/edit.html.erb, app/views/children/edit_photo.html.erb, app/views/children/index.html.erb, app/views/children/new.html.erb, app/views/children/search.html.erb, app/views/children/show.html.erb, app/views/histories/_audio_history_change.html.erb, app/views/histories/_flag_change.erb, app/views/histories/_history_change.html.erb, app/views/histories/_photo_history_change.html.erb, app/views/histories/_reunited_change.erb, app/views/histories/show.html.erb];[app/models/child.rb, features/step_definitions/basic_steps.rb]
https://github.com/rapidftr/RapidFTR;1080;[app/controllers/user_preferences_controller.rb, app/controllers/users_controller.rb, app/models/user.rb, app/views/home/index.html.erb, features/step_definitions/pdf_steps.rb, features/user_time_zones.feature, features/view_child_record_log.feature, spec/controllers/children_controller_spec.rb, spec/spec_helper.rb, spec/views/child/show.html.erb_spec.rb, spec/views/histories/show.html.erb_spec.rb];[app/controllers/child_media_controller.rb, app/controllers/children_controller.rb, app/controllers/form_section_controller.rb, app/controllers/histories_controller.rb, app/controllers/home_controller.rb, app/controllers/users_controller.rb, app/models/child.rb, app/models/form_section.rb, app/models/session.rb, app/models/user.rb, app/views/children/_audio_player.html.erb, app/views/children/_audio_upload_box.html.erb, app/views/children/_check_boxes.html.erb, app/views/children/_date_field.html.erb, app/views/children/_field_display_audio.html.erb, app/views/children/_field_display_basic.html.erb, app/views/children/_field_display_photo.html.erb, app/views/children/_form_section.html.erb, app/views/children/_form_section_info.html.erb, app/views/children/_numeric_field.html.erb, app/views/children/_photo_upload_box.html.erb, app/views/children/_picture.html.erb, app/views/children/_radio_button.html.erb, app/views/children/_repeatable_text_field.html.erb, app/views/children/_search_results.html.erb, app/views/children/_select_box.html.erb, app/views/children/_show_child_toolbar.erb, app/views/children/_show_form_section.html.erb, app/views/children/_summary_row.html.erb, app/views/children/_tabs.html.erb, app/views/children/_text_field.html.erb, app/views/children/_textarea.html.erb, app/views/children/edit.html.erb, app/views/children/edit_photo.html.erb, app/views/children/index.html.erb, app/views/children/new.html.erb, app/views/children/search.html.erb, app/views/children/show.html.erb, app/views/histories/_audio_history_change.html.erb, app/views/histories/_flag_change.erb, app/views/histories/_history_change.html.erb, app/views/histories/_photo_history_change.html.erb, app/views/histories/show.html.erb, app/views/home/index.html.erb];[features/step_definitions/basic_steps.rb, features/view_child_record_log.feature, spec/controllers/children_controller_spec.rb]
