Project;Task;Changed files;TestI;TextI
https://github.com/rapidftr/RapidFTR;92;[app/controllers/enquiries_controller.rb, app/controllers/potential_matches_controller.rb, app/models/enquiry.rb, app/views/children/_summary_row.html.erb, app/views/enquiries/_potential_matches.html.erb, app/views/enquiries/show.html.erb, config/locales/en.yml, config/routes.rb, features/enquiry_record_functionality.feature, features/step_definitions/enquiry_setup_steps.rb, spec/controllers/enquiries_controller_spec.rb, spec/controllers/potential_matches_controller_spec.rb, spec/integration/match_service_spec.rb, spec/models/enquiry_spec.rb, spec/views/enquiries/show.html.erb_spec.rb];[app/controllers/admin_controller.rb, app/controllers/advanced_search_controller.rb, app/controllers/api/child_media_controller.rb, app/controllers/api/children_controller.rb, app/controllers/api/enquiries_controller.rb, app/controllers/api/sessions_controller.rb, app/controllers/child_histories_controller.rb, app/controllers/child_ids_controller.rb, app/controllers/child_media_controller.rb, app/controllers/children_controller.rb, app/controllers/devices_controller.rb, app/controllers/duplicates_controller.rb, app/controllers/enquiries_controller.rb, app/controllers/fields_controller.rb, app/controllers/form_section_controller.rb, app/controllers/forms_controller.rb, app/controllers/potential_matches_controller.rb, app/controllers/replications_controller.rb, app/controllers/reports_controller.rb, app/controllers/roles_controller.rb, app/controllers/sessions_controller.rb, app/controllers/standard_forms_controller.rb, app/controllers/system_users_controller.rb, app/controllers/user_histories_controller.rb, app/controllers/users_controller.rb, app/models/child.rb, app/models/enquiry.rb, app/models/field.rb, app/models/form.rb, app/models/form_section.rb, app/models/permission.rb, app/models/replication.rb, app/models/report.rb, app/models/role.rb, app/models/session.rb, app/models/user.rb, app/views/admin/index.html.slim, app/views/advanced_search/index.html.erb, app/views/child_histories/index.html.erb, app/views/child_media/manage_photos.html.erb, app/views/children/_filter_box.html.erb, app/views/children/_header.html.erb, app/views/children/_mark_as.html.erb, app/views/children/_order_by_box.html.erb, app/views/children/_search_results.html.erb, app/views/children/_show_child_toolbar.erb, app/views/children/_summary_row.html.erb, app/views/children/_suspect_flag.html.erb, app/views/children/edit.html.erb, app/views/children/edit_photo.html.erb, app/views/children/index.html.erb, app/views/children/new.html.erb, app/views/children/search.html.erb, app/views/children/show.html.erb, app/views/devices/index.html.slim, app/views/duplicates/new.html.erb, app/views/enquiries/_header.html.erb, app/views/enquiries/_potential_matches.html.erb, app/views/enquiries/_summary_row.html.erb, app/views/enquiries/edit.html.erb, app/views/enquiries/index.html.erb, app/views/enquiries/index_with_potential_matches.html.erb, app/views/enquiries/new.html.erb, app/views/enquiries/show.html.erb, app/views/form_section/_add_field.html.erb, app/views/form_section/_delete_button.html.erb, app/views/form_section/_direction_button.html.erb, app/views/form_section/_form_section.html.erb, app/views/form_section/edit.html.erb, app/views/form_section/index.html.erb, app/views/form_section/new.html.erb, app/views/forms/index.html.erb, app/views/replications/_form.html.erb, app/views/replications/_index.html.erb, app/views/replications/edit.html.erb, app/views/replications/new.html.erb, app/views/replications/show.html.erb, app/views/reports/index.html.erb, app/views/roles/_editable_role.html.erb, app/views/roles/edit.html.erb, app/views/roles/index.html.erb, app/views/roles/new.html.erb, app/views/roles/show.html.erb, app/views/sessions/new.html.erb, app/views/shared/_add_translations.html.erb, app/views/shared/_fields.html.erb, app/views/shared/_form_section.html.erb, app/views/shared/_form_section_info.html.erb, app/views/shared/_pagination.html.erb, app/views/shared/_show_form_section.html.erb, app/views/shared/_side_tab.html.erb, app/views/shared/_sidebar.html.erb, app/views/shared/_tabs.html.erb, app/views/standard_forms/index.html.erb, app/views/system_users/_form.html.erb, app/views/system_users/edit.html.erb, app/views/system_users/index.html.erb, app/views/system_users/new.html.erb, app/views/user_histories/_no_activities.html.erb, app/views/user_histories/index.html.erb, app/views/users/_editable_user.html.erb, app/views/users/_mobile_login_history.html.erb, app/views/users/_user.html.erb, app/views/users/_user_disabled_checkbox.html.erb, app/views/users/_users_header.html.erb, app/views/users/_users_table.html.erb, app/views/users/change_password.html.erb, app/views/users/edit.html.erb, app/views/users/index.html.erb, app/views/users/new.html.erb, app/views/users/show.html.erb, app/views/users/unverified.html.erb];[app/controllers/enquiries_controller.rb, config/locales/en.yml, features/enquiry_record_functionality.feature, spec/controllers/enquiries_controller_spec.rb]
https://github.com/rapidftr/RapidFTR;96;[features/enquiry_record_functionality.feature, features/step_definitions/enquiry_setup_steps.rb, spec/views/enquiries/show.html.erb_spec.rb, app/views/children/_summary_row.html.erb, app/controllers/enquiries_controller.rb, config/locales/en.yml, spec/controllers/enquiries_controller_spec.rb, app/models/enquiry.rb, spec/models/enquiry_spec.rb, app/models/match_service.rb, spec/integration/match_service_spec.rb, app/views/enquiries/show.html.erb, config/routes.rb, app/views/enquiries/_potential_matches.html.erb];[app/controllers/admin_controller.rb, app/controllers/advanced_search_controller.rb, app/controllers/api/child_media_controller.rb, app/controllers/api/children_controller.rb, app/controllers/api/enquiries_controller.rb, app/controllers/api/sessions_controller.rb, app/controllers/child_histories_controller.rb, app/controllers/child_ids_controller.rb, app/controllers/child_media_controller.rb, app/controllers/children_controller.rb, app/controllers/devices_controller.rb, app/controllers/duplicates_controller.rb, app/controllers/enquiries_controller.rb, app/controllers/fields_controller.rb, app/controllers/form_section_controller.rb, app/controllers/forms_controller.rb, app/controllers/replications_controller.rb, app/controllers/reports_controller.rb, app/controllers/roles_controller.rb, app/controllers/sessions_controller.rb, app/controllers/standard_forms_controller.rb, app/controllers/system_users_controller.rb, app/controllers/user_histories_controller.rb, app/controllers/users_controller.rb, app/models/child.rb, app/models/enquiry.rb, app/models/field.rb, app/models/form.rb, app/models/form_section.rb, app/models/permission.rb, app/models/replication.rb, app/models/report.rb, app/models/role.rb, app/models/session.rb, app/models/user.rb, app/views/admin/index.html.slim, app/views/advanced_search/index.html.erb, app/views/child_histories/index.html.erb, app/views/child_media/manage_photos.html.erb, app/views/children/_filter_box.html.erb, app/views/children/_header.html.erb, app/views/children/_mark_as.html.erb, app/views/children/_order_by_box.html.erb, app/views/children/_search_results.html.erb, app/views/children/_show_child_toolbar.erb, app/views/children/_summary_row.html.erb, app/views/children/_suspect_flag.html.erb, app/views/children/edit.html.erb, app/views/children/edit_photo.html.erb, app/views/children/index.html.erb, app/views/children/new.html.erb, app/views/children/search.html.erb, app/views/children/show.html.erb, app/views/devices/index.html.slim, app/views/duplicates/new.html.erb, app/views/enquiries/_header.html.erb, app/views/enquiries/_potential_matches.html.erb, app/views/enquiries/_summary_row.html.erb, app/views/enquiries/edit.html.erb, app/views/enquiries/index.html.erb, app/views/enquiries/index_with_potential_matches.html.erb, app/views/enquiries/new.html.erb, app/views/enquiries/show.html.erb, app/views/form_section/_add_field.html.erb, app/views/form_section/_delete_button.html.erb, app/views/form_section/_direction_button.html.erb, app/views/form_section/_form_section.html.erb, app/views/form_section/edit.html.erb, app/views/form_section/index.html.erb, app/views/form_section/new.html.erb, app/views/forms/index.html.erb, app/views/replications/_form.html.erb, app/views/replications/_index.html.erb, app/views/replications/edit.html.erb, app/views/replications/new.html.erb, app/views/replications/show.html.erb, app/views/reports/index.html.erb, app/views/roles/_editable_role.html.erb, app/views/roles/edit.html.erb, app/views/roles/index.html.erb, app/views/roles/new.html.erb, app/views/roles/show.html.erb, app/views/sessions/new.html.erb, app/views/shared/_add_translations.html.erb, app/views/shared/_fields.html.erb, app/views/shared/_form_section.html.erb, app/views/shared/_form_section_info.html.erb, app/views/shared/_pagination.html.erb, app/views/shared/_show_form_section.html.erb, app/views/shared/_side_tab.html.erb, app/views/shared/_sidebar.html.erb, app/views/shared/_tabs.html.erb, app/views/standard_forms/index.html.erb, app/views/system_users/_form.html.erb, app/views/system_users/edit.html.erb, app/views/system_users/index.html.erb, app/views/system_users/new.html.erb, app/views/user_histories/_no_activities.html.erb, app/views/user_histories/index.html.erb, app/views/users/_editable_user.html.erb, app/views/users/_mobile_login_history.html.erb, app/views/users/_user.html.erb, app/views/users/_user_disabled_checkbox.html.erb, app/views/users/_users_header.html.erb, app/views/users/_users_table.html.erb, app/views/users/change_password.html.erb, app/views/users/edit.html.erb, app/views/users/index.html.erb, app/views/users/new.html.erb, app/views/users/show.html.erb, app/views/users/unverified.html.erb];[app/controllers/enquiries_controller.rb, app/models/ability.rb, config/locales/en.yml, features/enquiry_record_functionality.feature]
https://github.com/rapidftr/RapidFTR;97;[Gemfile, Gemfile.lock, app/assets/javascripts/form_section.js, app/controllers/fields_controller.rb, app/models/enquiry.rb, app/models/field.rb, app/models/form_section.rb, app/views/form_section/edit.html.erb, config/locales/en.yml, features/api/enquiries/create_or_edit_enquiry.feature, features/api/enquiries/sync_enquiries.feature, features/api/enquiries/trigger_matches_on_enquiry.feature, features/enquiry_record_functionality.feature, features/matching_children_to_enquiry.feature, features/step_definitions/form_field_steps.rb, features/step_definitions/form_section_steps.rb, features/support/pages/form_section_edit_page.rb, features/support/paths.rb, lib/rapid_ftr/enquiries_form_section_setup.rb, spec/controllers/fields_controller_spec.rb, spec/factories.rb, spec/models/enquiry_spec.rb, spec/models/field_spec.rb, spec/models/form_section_spec.rb];[app/controllers/admin_controller.rb, app/controllers/advanced_search_controller.rb, app/controllers/api/child_media_controller.rb, app/controllers/api/children_controller.rb, app/controllers/api/enquiries_controller.rb, app/controllers/api/sessions_controller.rb, app/controllers/child_histories_controller.rb, app/controllers/child_ids_controller.rb, app/controllers/child_media_controller.rb, app/controllers/children_controller.rb, app/controllers/devices_controller.rb, app/controllers/duplicates_controller.rb, app/controllers/enquiries_controller.rb, app/controllers/fields_controller.rb, app/controllers/form_section_controller.rb, app/controllers/forms_controller.rb, app/controllers/replications_controller.rb, app/controllers/reports_controller.rb, app/controllers/roles_controller.rb, app/controllers/sessions_controller.rb, app/controllers/standard_forms_controller.rb, app/controllers/system_users_controller.rb, app/controllers/user_histories_controller.rb, app/controllers/users_controller.rb, app/models/child.rb, app/models/enquiry.rb, app/models/field.rb, app/models/form.rb, app/models/form_section.rb, app/models/permission.rb, app/models/replication.rb, app/models/report.rb, app/models/role.rb, app/models/session.rb, app/models/user.rb, app/views/admin/index.html.slim, app/views/advanced_search/index.html.erb, app/views/child_histories/index.html.erb, app/views/child_media/manage_photos.html.erb, app/views/children/_filter_box.html.erb, app/views/children/_header.html.erb, app/views/children/_mark_as.html.erb, app/views/children/_order_by_box.html.erb, app/views/children/_search_results.html.erb, app/views/children/_show_child_toolbar.erb, app/views/children/_summary_row.html.erb, app/views/children/_suspect_flag.html.erb, app/views/children/edit.html.erb, app/views/children/edit_photo.html.erb, app/views/children/index.html.erb, app/views/children/new.html.erb, app/views/children/search.html.erb, app/views/children/show.html.erb, app/views/devices/index.html.slim, app/views/duplicates/new.html.erb, app/views/enquiries/_header.html.erb, app/views/enquiries/_potential_matches.html.erb, app/views/enquiries/_summary_row.html.erb, app/views/enquiries/edit.html.erb, app/views/enquiries/index.html.erb, app/views/enquiries/index_with_potential_matches.html.erb, app/views/enquiries/new.html.erb, app/views/enquiries/show.html.erb, app/views/form_section/_add_field.html.erb, app/views/form_section/_delete_button.html.erb, app/views/form_section/_direction_button.html.erb, app/views/form_section/_form_section.html.erb, app/views/form_section/edit.html.erb, app/views/form_section/index.html.erb, app/views/form_section/new.html.erb, app/views/forms/index.html.erb, app/views/replications/_form.html.erb, app/views/replications/_index.html.erb, app/views/replications/edit.html.erb, app/views/replications/new.html.erb, app/views/replications/show.html.erb, app/views/reports/index.html.erb, app/views/roles/_editable_role.html.erb, app/views/roles/edit.html.erb, app/views/roles/index.html.erb, app/views/roles/new.html.erb, app/views/roles/show.html.erb, app/views/sessions/new.html.erb, app/views/shared/_add_translations.html.erb, app/views/shared/_fields.html.erb, app/views/shared/_form_section.html.erb, app/views/shared/_form_section_info.html.erb, app/views/shared/_pagination.html.erb, app/views/shared/_show_form_section.html.erb, app/views/shared/_side_tab.html.erb, app/views/shared/_sidebar.html.erb, app/views/shared/_tabs.html.erb, app/views/standard_forms/index.html.erb, app/views/system_users/_form.html.erb, app/views/system_users/edit.html.erb, app/views/system_users/index.html.erb, app/views/system_users/new.html.erb, app/views/user_histories/_no_activities.html.erb, app/views/user_histories/index.html.erb, app/views/users/_editable_user.html.erb, app/views/users/_mobile_login_history.html.erb, app/views/users/_user.html.erb, app/views/users/_user_disabled_checkbox.html.erb, app/views/users/_users_header.html.erb, app/views/users/_users_table.html.erb, app/views/users/change_password.html.erb, app/views/users/edit.html.erb, app/views/users/index.html.erb, app/views/users/new.html.erb, app/views/users/show.html.erb, app/views/users/unverified.html.erb];[app/controllers/enquiries_controller.rb, app/models/ability.rb, config/locales/en.yml, features/enquiry_record_functionality.feature, spec/controllers/enquiries_controller_spec.rb]
https://github.com/rapidftr/RapidFTR;103;[app/assets/javascripts/rapidftr.js, lib/rapid_ftr/children_form_section_setup.rb, .rubocop.yml, .rubocop_todo.yml, Gemfile, Gemfile.lock, app/controllers/advanced_search_controller.rb, app/controllers/api/child_media_controller.rb, app/controllers/api/device_controller.rb, app/controllers/child_media_controller.rb, app/controllers/fields_controller.rb, app/controllers/roles_controller.rb, app/helpers/advanced_search_helper.rb, app/helpers/children_helper.rb, app/helpers/record_helper.rb, app/models/child.rb, app/models/enquiry.rb, app/models/field.rb, app/models/form.rb, app/models/form_section.rb, app/models/forms/search_form.rb, app/models/login.rb, app/models/migration.rb, app/models/replication.rb, app/models/role.rb, app/models/system_users.rb, app/models/user.rb, app/views/shared/_field_display_audio.html.erb, config/routes.rb, db/migration/0009_migrate_export_permissions.rb, features/step_definitions/basic_steps.rb, features/support/paths.rb, lib/couch_settings.rb, lib/export_generator.rb, spec/controllers/api/device_controller_spec.rb, spec/controllers/children_controller_spec.rb, spec/controllers/fields_controller_spec.rb, spec/controllers/users_controller_spec.rb, spec/integration/children_spec.rb, spec/lib/security/authentication_spec.rb, spec/lib/security/session_secret_spec.rb, spec/models/child_spec.rb, spec/models/couchrest_model_spec.rb, spec/models/device_spec.rb, spec/models/field_spec.rb, spec/models/form_section_spec.rb, spec/models/forms/standard_forms_form_spec.rb, spec/models/replication_spec.rb, spec/models/role_spec.rb, spec/models/user_spec.rb, spec/routing/formsection_routing_spec.rb, spec/views/form_section/edit.html.erb_spec.rb, app/controllers/enquiries_controller.rb, app/helpers/application_helper.rb, app/models/ability.rb, app/views/enquiries/edit.html.erb, config/locales/en.yml, features/enquiry_record_functionality.feature, spec/controllers/enquiries_controller_spec.rb, spec/views/enquiries/edit.html.erb_spec.rb];[app/controllers/admin_controller.rb, app/controllers/advanced_search_controller.rb, app/controllers/api/child_media_controller.rb, app/controllers/api/children_controller.rb, app/controllers/api/enquiries_controller.rb, app/controllers/api/sessions_controller.rb, app/controllers/child_histories_controller.rb, app/controllers/child_ids_controller.rb, app/controllers/child_media_controller.rb, app/controllers/children_controller.rb, app/controllers/devices_controller.rb, app/controllers/duplicates_controller.rb, app/controllers/enquiries_controller.rb, app/controllers/fields_controller.rb, app/controllers/form_section_controller.rb, app/controllers/forms_controller.rb, app/controllers/highlight_fields_controller.rb, app/controllers/replications_controller.rb, app/controllers/reports_controller.rb, app/controllers/roles_controller.rb, app/controllers/sessions_controller.rb, app/controllers/standard_forms_controller.rb, app/controllers/system_logs_controller.rb, app/controllers/system_users_controller.rb, app/controllers/user_histories_controller.rb, app/controllers/users_controller.rb, app/models/child.rb, app/models/device.rb, app/models/enquiry.rb, app/models/field.rb, app/models/form.rb, app/models/form_section.rb, app/models/permission.rb, app/models/replication.rb, app/models/report.rb, app/models/role.rb, app/models/session.rb, app/models/user.rb, app/views/admin/index.html.erb, app/views/advanced_search/index.html.erb, app/views/child_histories/index.html.erb, app/views/child_media/manage_photos.html.erb, app/views/children/_filter_box.html.erb, app/views/children/_header.html.erb, app/views/children/_mark_as.html.erb, app/views/children/_order_by_box.html.erb, app/views/children/_search_results.html.erb, app/views/children/_show_child_toolbar.erb, app/views/children/_summary_row.html.erb, app/views/children/_suspect_flag.html.erb, app/views/children/edit.html.erb, app/views/children/edit_photo.html.erb, app/views/children/index.html.erb, app/views/children/new.html.erb, app/views/children/search.html.erb, app/views/children/show.html.erb, app/views/devices/index.html.erb, app/views/duplicates/new.html.erb, app/views/enquiries/_header.html.erb, app/views/enquiries/_potential_matches.html.erb, app/views/enquiries/_summary_row.html.erb, app/views/enquiries/edit.html.erb, app/views/enquiries/index.html.erb, app/views/enquiries/index_with_potential_matches.html.erb, app/views/enquiries/new.html.erb, app/views/enquiries/show.html.erb, app/views/form_section/_add_field.html.erb, app/views/form_section/_delete_button.html.erb, app/views/form_section/_direction_button.html.erb, app/views/form_section/_form_section.html.erb, app/views/form_section/edit.html.erb, app/views/form_section/index.html.erb, app/views/form_section/new.html.erb, app/views/forms/index.html.erb, app/views/highlight_fields/index.html.erb, app/views/highlight_fields/show.html.erb, app/views/replications/_form.html.erb, app/views/replications/_index.html.erb, app/views/replications/edit.html.erb, app/views/replications/new.html.erb, app/views/replications/show.html.erb, app/views/reports/index.html.erb, app/views/roles/_editable_role.html.erb, app/views/roles/edit.html.erb, app/views/roles/index.html.erb, app/views/roles/new.html.erb, app/views/roles/show.html.erb, app/views/sessions/new.html.erb, app/views/shared/_add_translations.html.erb, app/views/shared/_fields.html.erb, app/views/shared/_form_fields.html.erb, app/views/shared/_form_section.html.erb, app/views/shared/_form_section_info.html.erb, app/views/shared/_pagination.html.erb, app/views/shared/_show_form_section.html.erb, app/views/shared/_side_tab.html.erb, app/views/shared/_sidebar.html.erb, app/views/shared/_tabs.html.erb, app/views/standard_forms/index.html.erb, app/views/system_logs/index.html.erb, app/views/system_users/_form.html.erb, app/views/system_users/edit.html.erb, app/views/system_users/index.html.erb, app/views/system_users/new.html.erb, app/views/user_histories/_no_activities.html.erb, app/views/user_histories/index.html.erb, app/views/users/_editable_user.html.erb, app/views/users/_mobile_login_history.html.erb, app/views/users/_user.html.erb, app/views/users/_user_disabled_checkbox.html.erb, app/views/users/_users_header.html.erb, app/views/users/_users_table.html.erb, app/views/users/change_password.html.erb, app/views/users/edit.html.erb, app/views/users/index.html.erb, app/views/users/new.html.erb, app/views/users/show.html.erb, app/views/users/unverified.html.erb];[app/controllers/enquiries_controller.rb, app/models/ability.rb, config/locales/en.yml, features/enquiry_record_functionality.feature]
