Project;Task;Changed files;TestI;TextI
https://github.com/rapidftr/RapidFTR;1208;[app/controllers/children_controller.rb, app/views/admin/index.html.erb, app/views/children/_search_results.html.erb, app/views/children/show.html.erb, config/routes.rb, features/csv_export.feature, features/pdf_export.feature, spec/controllers/children_controller_spec.rb, spec/routing/children_routing_spec.rb, app/views/users/_edittable_user.html.erb, features/edit_user_details.feature, app/views/users/index.html.erb, features/manage_users.feature, app/helpers/application_helper.rb, app/views/children/edit.html.erb, app/views/children/new.html.erb, features/create_child_record.feature, features/edit_child_record.feature, public/stylesheets/core.css, app/views/layouts/application.html.erb];[app/controllers/admin_controller.rb, app/controllers/child_media_controller.rb, app/controllers/children_controller.rb, app/controllers/fields_controller.rb, app/controllers/form_section_controller.rb, app/controllers/users_controller.rb, app/models/child.rb, app/models/form_section.rb, app/models/session.rb, app/models/user.rb, app/views/admin/index.html.erb, app/views/children/_form_section.html.erb, app/views/children/_tabs.html.erb, app/views/children/edit.html.erb, app/views/children/index.html.erb, app/views/children/new.html.erb, app/views/fields/_delete_button.html.erb, app/views/fields/_direction_button.html.erb, app/views/fields/index.html.erb, app/views/form_section/index.html.erb, app/views/users/_edittable_user.html.erb, app/views/users/edit.html.erb, app/views/users/index.html.erb, app/views/users/new.html.erb];[features/create_child_record.feature, features/edit_child_record.feature]
https://github.com/rapidftr/RapidFTR;1210;[app/views/children/_summary_row.html.erb, app/views/children/index.html.erb, features/create_child_record.feature, public/stylesheets/core.css];[app/controllers/admin_controller.rb, app/controllers/children_controller.rb, app/controllers/form_section_controller.rb, app/controllers/histories_controller.rb, app/controllers/users_controller.rb, app/models/form_section.rb, app/models/session.rb, app/models/user.rb, app/views/admin/index.html.erb, app/views/children/_form_section.html.erb, app/views/children/_tabs.html.erb, app/views/children/edit.html.erb, app/views/children/edit_photo.html.erb, app/views/children/index.html.erb, app/views/children/new.html.erb, app/views/children/show.html.erb, app/views/form_section/index.html.erb, app/views/histories/_audio_history_change.html.erb, app/views/histories/_history_change.html.erb, app/views/histories/_photo_history_change.html.erb, app/views/histories/show.html.erb, app/views/users/_edittable_user.html.erb, app/views/users/edit.html.erb, app/views/users/index.html.erb, app/views/users/new.html.erb];[app/models/templates.rb, features/create_child_record.feature]
https://github.com/rapidftr/RapidFTR;1215;[app/controllers/checks_authentication.rb, features/api_authentication.feature, features/step_definitions/database_steps.rb, features/webapp_authentication.feature];[app/controllers/admin_controller.rb, app/controllers/child_ids_controller.rb, app/controllers/children_controller.rb, app/controllers/fields_controller.rb, app/controllers/form_section_controller.rb, app/controllers/histories_controller.rb, app/controllers/home_controller.rb, app/controllers/sessions_controller.rb, app/controllers/users_controller.rb, app/helpers/application_helper.rb, app/models/child.rb, app/models/form_section.rb, app/models/searchable.rb, app/models/session.rb, app/models/summary.rb, app/models/user.rb, app/views/admin/index.html.erb, app/views/children/_form_section.html.erb, app/views/children/_search_results.html.erb, app/views/children/_summary_row.html.erb, app/views/children/_tabs.html.erb, app/views/children/edit.html.erb, app/views/children/edit_photo.html.erb, app/views/children/index.html.erb, app/views/children/new.html.erb, app/views/children/search.html.erb, app/views/children/show.html.erb, app/views/fields/_basic_new_field_form.html.erb, app/views/fields/_suggested_field.html.erb, app/views/fields/confirm_toggle.html.erb, app/views/fields/new.html.erb, app/views/fields/new_check_box.html.erb, app/views/fields/new_date_field.html.erb, app/views/fields/new_numeric_field.html.erb, app/views/fields/new_select_drop_down.html.erb, app/views/fields/new_text_field.html.erb, app/views/fields/new_textarea.html.erb, app/views/form_section/index.html.erb, app/views/form_section/new.html.erb, app/views/histories/_audio_history_change.html.erb, app/views/histories/_history_change.html.erb, app/views/histories/_photo_history_change.html.erb, app/views/histories/show.html.erb, app/views/home/index.html.erb, app/views/sessions/new.html.erb, app/views/sessions/show.html.erb, app/views/users/_edittable_user.html.erb, app/views/users/edit.html.erb, app/views/users/index.html.erb, app/views/users/new.html.erb];[app/controllers/sessions_controller.rb, config/routes.rb, features/step_definitions/basic_steps.rb, features/user_login.feature]
https://github.com/rapidftr/RapidFTR;1216;[app/models/child.rb, app/views/children/_errors.html.erb, app/views/children/_numeric_field.html.erb, app/views/children/edit.html.erb, app/views/children/new.html.erb, app/views/layouts/application.html.erb, features/create_child_record.feature, public/javascripts/application.js, public/javascripts/jquery.validate.min.js, spec/models/child_spec.rb];[app/controllers/children_controller.rb, app/controllers/sessions_controller.rb, app/controllers/users_controller.rb, app/models/field.rb, app/models/form_section.rb, app/models/session.rb, app/models/user.rb, app/views/children/_form_section.html.erb, app/views/children/_tabs.html.erb, app/views/children/new.html.erb];[features/step_definitions/basic_steps.rb]
https://github.com/rapidftr/RapidFTR;1217;[app/views/fields/new_select_drop_down.html.erb, app/views/form_section/edit.html.erb, features/create_custom_fields.feature, public/stylesheets/core.css];[app/controllers/fields_controller.rb, app/views/fields/_basic_new_field_form.html.erb, app/views/fields/_suggested_field.html.erb, app/views/fields/confirm_toggle.html.erb, app/views/fields/new.html.erb, app/views/fields/new_check_box.html.erb, app/views/fields/new_date_field.html.erb, app/views/fields/new_numeric_field.html.erb, app/views/fields/new_select_drop_down.html.erb, app/views/fields/new_text_field.html.erb, app/views/fields/new_textarea.html.erb];[app/controllers/fields_controller.rb]
https://github.com/rapidftr/RapidFTR;1219;[app/views/form_section/edit.html.erb, features/create_custom_fields.feature];[app/controllers/fields_controller.rb, app/views/fields/_basic_new_field_form.html.erb, app/views/fields/_suggested_field.html.erb, app/views/fields/confirm_toggle.html.erb, app/views/fields/new.html.erb, app/views/fields/new_check_box.html.erb, app/views/fields/new_date_field.html.erb, app/views/fields/new_numeric_field.html.erb, app/views/fields/new_select_drop_down.html.erb, app/views/fields/new_text_field.html.erb, app/views/fields/new_textarea.html.erb];[features/add_suggested_field_to_form_sections.feature, features/step_definitions/basic_steps.rb]
https://github.com/rapidftr/RapidFTR;1221;[app/views/form_section/edit.html.erb, app/controllers/fields_controller.rb, app/views/fields/confirm_toggle.html.erb, app/views/fields/index.html.erb, config/routes.rb, features/disable_enable_form_fields.feature, features/step_definitions/basic_steps.rb, spec/controllers/fields_controller_spec.rb, spec/views/formsections/edit.html.erb_spec.rb];[app/controllers/fields_controller.rb, app/models/field.rb, app/models/form_section.rb, app/views/fields/_basic_new_field_form.html.erb, app/views/fields/_suggested_field.html.erb, app/views/fields/confirm_toggle.html.erb, app/views/fields/new.html.erb, app/views/fields/new_check_box.html.erb, app/views/fields/new_date_field.html.erb, app/views/fields/new_numeric_field.html.erb, app/views/fields/new_select_drop_down.html.erb, app/views/fields/new_text_field.html.erb, app/views/fields/new_textarea.html.erb];[app/controllers/fields_controller.rb, features/step_definitions/basic_steps.rb, spec/controllers/fields_controller_spec.rb]
https://github.com/rapidftr/RapidFTR;1222;[app/views/users/_edittable_user.html.erb, features/edit_user_details.feature, app/views/users/index.html.erb, features/manage_users.feature, app/helpers/application_helper.rb, app/views/children/edit.html.erb, app/views/children/new.html.erb, features/create_child_record.feature, features/edit_child_record.feature, public/stylesheets/core.css, app/views/layouts/application.html.erb, config/nginx-production.conf, config/nginx-uat.conf];[app/controllers/admin_controller.rb, app/controllers/child_media_controller.rb, app/controllers/children_controller.rb, app/controllers/form_section_controller.rb, app/controllers/users_controller.rb, app/models/child.rb, app/models/form_section.rb, app/models/session.rb, app/models/user.rb, app/views/admin/index.html.erb, app/views/children/_form_section.html.erb, app/views/children/_tabs.html.erb, app/views/children/edit.html.erb, app/views/children/index.html.erb, app/views/children/new.html.erb, app/views/form_section/index.html.erb, app/views/users/_edittable_user.html.erb, app/views/users/edit.html.erb, app/views/users/index.html.erb, app/views/users/new.html.erb];[features/create_child_record.feature, features/edit_child_record.feature]
https://github.com/rapidftr/RapidFTR;1224;[app/controllers/fields_controller.rb, app/models/form_section.rb, app/views/children/_form_section.html.erb, app/views/fields/index.html.erb, features/disable_enable_form_fields.feature, spec/controllers/fields_controller_spec.rb, spec/models/form_section_spec.rb, app/models/field.rb, config/routes.rb, features/step_definitions/basic_steps.rb, features/step_definitions/form_section_steps.rb, spec/models/field_spec.rb, spec/views/Fields/index.html.erb_spec.rb];[app/controllers/admin_controller.rb, app/controllers/children_controller.rb, app/controllers/fields_controller.rb, app/controllers/form_section_controller.rb, app/controllers/users_controller.rb, app/models/form_section.rb, app/models/user.rb, app/views/admin/index.html.erb, app/views/children/_form_section.html.erb, app/views/children/_tabs.html.erb, app/views/children/edit.html.erb, app/views/children/index.html.erb, app/views/children/new.html.erb, app/views/fields/_delete_button.html.erb, app/views/fields/_direction_button.html.erb, app/views/fields/index.html.erb, app/views/form_section/index.html.erb, app/views/users/_edittable_user.html.erb, app/views/users/edit.html.erb, app/views/users/index.html.erb, app/views/users/new.html.erb];[features/add_custom_field_to_form_section.feature]
https://github.com/rapidftr/RapidFTR;1225;[app/controllers/fields_controller.rb, spec/controllers/fields_controller_spec.rb, app/controllers/form_section_controller.rb, app/models/form_section.rb, app/views/form_section/_delete_button.html.erb, app/views/form_section/_direction_button.html.erb, app/views/form_section/edit.html.erb, app/views/form_section/index.html.erb, features/add_custom_field_to_form_section.feature, features/add_suggested_field_to_form_sections.feature, features/admin_access.feature, features/create_custom_fields.feature, features/delete_field_from_forms_section.feature, features/edit_form_section.feature, features/reorder_fields.feature, features/step_definitions/basic_steps.rb, features/step_definitions/form_section_steps.rb, features/support/paths.rb, public/stylesheets/core.css, spec/controllers/form_section_controller_spec.rb, spec/models/form_section_spec.rb, spec/views/Fields/index.html.erb_spec.rb, spec/views/formsections/index.html.erb_spec.rb];[app/controllers/admin_controller.rb, app/controllers/child_ids_controller.rb, app/controllers/children_controller.rb, app/controllers/fields_controller.rb, app/controllers/form_section_controller.rb, app/controllers/histories_controller.rb, app/controllers/sessions_controller.rb, app/controllers/users_controller.rb, app/helpers/application_helper.rb, app/models/child.rb, app/models/field.rb, app/models/form_section.rb, app/models/session.rb, app/models/suggested_field.rb, app/models/summary.rb, app/models/user.rb, app/views/admin/index.html.erb, app/views/children/_form_section.html.erb, app/views/children/_search_results.html.erb, app/views/children/_summary_row.html.erb, app/views/children/_tabs.html.erb, app/views/children/edit.html.erb, app/views/children/index.html.erb, app/views/children/new.html.erb, app/views/children/search.html.erb, app/views/children/show.html.erb, app/views/fields/_suggested_field.html.erb, app/views/fields/index.html.erb, app/views/fields/new.html.erb, app/views/fields/new_check_box.html.erb, app/views/fields/new_date_field.html.erb, app/views/fields/new_numeric_field.html.erb, app/views/fields/new_select_drop_down.html.erb, app/views/fields/new_text_field.html.erb, app/views/fields/new_textarea.html.erb, app/views/form_section/index.html.erb, app/views/form_section/new.html.erb, app/views/histories/_audio_history_change.html.erb, app/views/histories/_history_change.html.erb, app/views/histories/_photo_history_change.html.erb, app/views/histories/show.html.erb, app/views/sessions/new.html.erb, app/views/sessions/show.html.erb, app/views/users/_edittable_user.html.erb, app/views/users/edit.html.erb, app/views/users/index.html.erb, app/views/users/new.html.erb, lib/authorization_failure.rb];[features/add_custom_field_to_form_section.feature]
https://github.com/rapidftr/RapidFTR;1227;[public/stylesheets/core.css, public/javascripts/application.js, app/views/children/_date_field.html.erb, spec/views/child/form_section.html.erb_spec.rb, app/views/users/index.html.erb, app/models/child.rb, features/pdf_export.feature, features/step_definitions/basic_steps.rb, lib/pdf_generator.rb, spec/models/child_spec.rb];[app/models/child.rb, app/models/session.rb, app/models/user.rb];[app/controllers/children_controller.rb, features/pdf_export.feature, features/step_definitions/pdf_steps.rb, lib/pdf_generator.rb]
https://github.com/rapidftr/RapidFTR;1233;[features/create_child_record.feature, features/edit_child_record.feature, features/step_definitions/basic_steps.rb, spec/support/hpricot_search.rb, app/controllers/sessions_controller.rb, app/models/suggested_field.rb, features/step_definitions/photo_thumbnail_steps.rb, spec/controllers/child_media_controller_spec.rb, spec/controllers/form_section_controller_spec.rb, spec/models/form_section_spec.rb, spec/routing/formsection_routing_spec.rb, spec/views/child/show.html.erb_spec.rb, spec/views/histories/show.html.erb_spec.rb];[app/controllers/admin_controller.rb, app/controllers/child_media_controller.rb, app/controllers/children_controller.rb, app/controllers/fields_controller.rb, app/controllers/form_section_controller.rb, app/controllers/users_controller.rb, app/models/child.rb, app/models/form_section.rb, app/models/session.rb, app/models/user.rb, app/views/admin/index.html.erb, app/views/children/_form_section.html.erb, app/views/children/_tabs.html.erb, app/views/children/edit.html.erb, app/views/children/index.html.erb, app/views/children/new.html.erb, app/views/fields/_delete_button.html.erb, app/views/fields/_direction_button.html.erb, app/views/fields/index.html.erb, app/views/form_section/index.html.erb, app/views/users/_edittable_user.html.erb, app/views/users/edit.html.erb, app/views/users/index.html.erb, app/views/users/new.html.erb];[features/edit_child_record.feature, features/support/paths.rb]
https://github.com/rapidftr/RapidFTR;1234;[app/views/children/_date_field.html.erb, app/views/layouts/application.html.erb, features/add_custom_field_to_form_section.feature, public/javascripts/jquery-ui-1.8.6.custom.min.js, public/stylesheets/overcast/images/ui-bg_flat_0_aaaaaa_40x100.png, public/stylesheets/overcast/images/ui-bg_flat_0_eeeeee_40x100.png, public/stylesheets/overcast/images/ui-bg_flat_55_c0402a_40x100.png, public/stylesheets/overcast/images/ui-bg_flat_55_eeeeee_40x100.png, public/stylesheets/overcast/images/ui-bg_glass_100_f8f8f8_1x400.png, public/stylesheets/overcast/images/ui-bg_glass_35_dddddd_1x400.png, public/stylesheets/overcast/images/ui-bg_glass_60_eeeeee_1x400.png, public/stylesheets/overcast/images/ui-bg_inset-hard_75_999999_1x100.png, public/stylesheets/overcast/images/ui-bg_inset-soft_50_c9c9c9_1x100.png, public/stylesheets/overcast/images/ui-icons_3383bb_256x240.png, public/stylesheets/overcast/images/ui-icons_454545_256x240.png, public/stylesheets/overcast/images/ui-icons_70b2e1_256x240.png, public/stylesheets/overcast/images/ui-icons_999999_256x240.png, public/stylesheets/overcast/images/ui-icons_fbc856_256x240.png, public/stylesheets/overcast/jquery-ui-1.8.6.custom.css, spec/views/child/form_section.html.erb_spec.rb];[app/controllers/admin_controller.rb, app/controllers/child_ids_controller.rb, app/controllers/children_controller.rb, app/controllers/fields_controller.rb, app/controllers/form_section_controller.rb, app/controllers/histories_controller.rb, app/controllers/sessions_controller.rb, app/controllers/users_controller.rb, app/helpers/application_helper.rb, app/models/child.rb, app/models/form_section.rb, app/models/summary.rb, app/models/user.rb, app/views/admin/index.html.erb, app/views/children/_form_section.html.erb, app/views/children/_search_results.html.erb, app/views/children/_summary_row.html.erb, app/views/children/_tabs.html.erb, app/views/children/edit.html.erb, app/views/children/index.html.erb, app/views/children/new.html.erb, app/views/children/search.html.erb, app/views/children/show.html.erb, app/views/fields/_delete_button.html.erb, app/views/fields/_direction_button.html.erb, app/views/fields/_edit_button.html.erb, app/views/fields/_suggested_field.html.erb, app/views/fields/index.html.erb, app/views/fields/new.html.erb, app/views/fields/new_check_box.html.erb, app/views/fields/new_date_field.html.erb, app/views/fields/new_numeric_field.html.erb, app/views/fields/new_select_drop_down.html.erb, app/views/fields/new_text_field.html.erb, app/views/fields/new_textarea.html.erb, app/views/form_section/index.html.erb, app/views/form_section/new.html.erb, app/views/histories/_audio_history_change.html.erb, app/views/histories/_history_change.html.erb, app/views/histories/_photo_history_change.html.erb, app/views/histories/show.html.erb, app/views/sessions/new.html.erb, app/views/sessions/show.html.erb, app/views/users/_edittable_user.html.erb, app/views/users/edit.html.erb, app/views/users/index.html.erb, app/views/users/new.html.erb];[features/add_custom_field_to_form_section.feature]
https://github.com/rapidftr/RapidFTR;1236;[app/controllers/children_controller.rb, features/csv_export.feature, spec/controllers/children_controller_spec.rb, app/views/admin/index.html.erb, features/step_definitions/csv_steps.rb];[app/controllers/admin_controller.rb, app/controllers/children_controller.rb, app/controllers/fields_controller.rb, app/controllers/form_section_controller.rb, app/controllers/users_controller.rb, app/models/child.rb, app/models/form_section.rb, app/models/session.rb, app/models/user.rb, app/views/admin/index.html.erb, app/views/children/_form_section.html.erb, app/views/children/_tabs.html.erb, app/views/children/edit.html.erb, app/views/children/index.html.erb, app/views/children/new.html.erb, app/views/fields/_delete_button.html.erb, app/views/fields/_direction_button.html.erb, app/views/fields/index.html.erb, app/views/form_section/index.html.erb, app/views/users/_edittable_user.html.erb, app/views/users/edit.html.erb, app/views/users/index.html.erb, app/views/users/new.html.erb];[app/controllers/children_controller.rb, app/helpers/application_helper.rb, app/models/child.rb, app/views/children/_summary_row.html.erb, app/views/children/search.html.erb, config/routes.rb, features/basic_search.feature, features/step_definitions/basic_steps.rb, features/support/paths.rb, spec/controllers/children_controller_spec.rb]
https://github.com/rapidftr/RapidFTR;1237;[app/controllers/children_controller.rb, features/basic_search.feature, features/step_definitions/basic_steps.rb, spec/controllers/children_controller_spec.rb, app/models/summary.rb, spec/models/summary_spec.rb, app/views/children/advanced_search.html.erb, app/models/advanced_search.rb, spec/models/advanced_search_spec.rb, app/views/children/search.html.erb, app/models/child.rb, app/models/search.rb, spec/models/child_spec.rb, spec/models/search_spec.rb];[app/models/child.rb, app/models/session.rb, app/models/user.rb];[app/controllers/children/summaries_controller.rb, app/models/search_request.rb, app/views/children/summaries/new.html.erb, app/views/children/summaries/show.html.erb, features/basic_search.feature, features/support/paths.rb, spec/controllers/children/summaries_controller_spec.rb, spec/views/children/summaries/new.html.erb_spec.rb]
https://github.com/rapidftr/RapidFTR;1241;[app/controllers/children_controller.rb, app/models/child.rb, lib/tasks/sunspot.rake, spec/models/child_spec.rb, .gitignore, app/views/children/search.html.erb, features/back_to_results_child_record.feature, features/basic_search.feature, features/support/reset_couchdb.rb, public/stylesheets/core.css, spec/controllers/children_controller_spec.rb, spec/integration/solar_spec.rb, app/models/searchable.rb, features/step_definitions/api_steps.rb, spec/controllers/child_ids_controller_spec.rb, Gemfile, Gemfile.lock];[app/controllers/admin_controller.rb, app/controllers/child_ids_controller.rb, app/controllers/children_controller.rb, app/controllers/fields_controller.rb, app/controllers/form_section_controller.rb, app/controllers/histories_controller.rb, app/controllers/sessions_controller.rb, app/controllers/users_controller.rb, app/helpers/application_helper.rb, app/models/child.rb, app/models/form_section.rb, app/models/session.rb, app/models/summary.rb, app/models/user.rb, app/views/admin/index.html.erb, app/views/children/_form_section.html.erb, app/views/children/_search_results.html.erb, app/views/children/_summary_row.html.erb, app/views/children/_tabs.html.erb, app/views/children/edit.html.erb, app/views/children/index.html.erb, app/views/children/new.html.erb, app/views/children/search.html.erb, app/views/children/show.html.erb, app/views/fields/_delete_button.html.erb, app/views/fields/_direction_button.html.erb, app/views/fields/_suggested_field.html.erb, app/views/fields/index.html.erb, app/views/fields/new.html.erb, app/views/fields/new_check_box.html.erb, app/views/fields/new_numeric_field.html.erb, app/views/fields/new_select_drop_down.html.erb, app/views/fields/new_text_field.html.erb, app/views/fields/new_textarea.html.erb, app/views/form_section/index.html.erb, app/views/form_section/new.html.erb, app/views/histories/_audio_history_change.html.erb, app/views/histories/_history_change.html.erb, app/views/histories/_photo_history_change.html.erb, app/views/histories/show.html.erb, app/views/sessions/new.html.erb, app/views/sessions/show.html.erb, app/views/users/_edittable_user.html.erb, app/views/users/edit.html.erb, app/views/users/index.html.erb, app/views/users/new.html.erb];[app/controllers/children/summaries_controller.rb, app/controllers/children_controller.rb, app/helpers/summaries_helper.rb, app/models/child.rb, app/models/search_request.rb, app/models/templates.rb, app/views/children/summaries/create.html.erb, app/views/children/summaries/new.html.erb, app/views/children/summaries/show.html.erb, config/routes.rb, features/basic_search.feature, features/step_definitions/basic_steps.rb, features/support/paths.rb, spec/controllers/children/summaries_controller_spec.rb, spec/controllers/children_controller_spec.rb, spec/helpers/summaries_helper_spec.rb, spec/models/search_request_spec.rb, spec/views/children/summaries/new.html.erb_spec.rb]
https://github.com/rapidftr/RapidFTR;1243;[app/helpers/fields_helper.rb, app/models/suggested_field.rb, app/views/fields/_delete_button.html.erb, app/views/fields/_suggested_field.html.erb, app/views/fields/new.html.erb, features/add_caregiver_details_to_a_child_record.feature, features/add_suggested_field_to_form_sections.feature, features/step_definitions/basic_steps.rb, lib/suggested_fields_db_setup.rb, spec/controllers/fields_controller_spec.rb, app/controllers/fields_controller.rb, app/models/field.rb, app/views/children/_check_box.html.erb, app/views/children/_numeric_field.erb, app/views/children/_select_box.html.erb, app/views/children/_text_field.html.erb, app/views/children/_textarea.html.erb, app/views/fields/_basic_new_field_form.html.erb, app/views/fields/index.html.erb, lib/rapidftr_default_db_setup.rb];[app/models/field.rb, app/models/session.rb, app/models/suggested_field.rb, app/models/user.rb];[features/create_child_record.feature]
