Project,Task,Changed files,TestI,TextI,TestIWithDeps,IsolatedDeps,Precision,Recall,F2,PrecisionDeps,RecallDeps,F2Deps,ProductionChangedFiles,TestIwithFilteredDeps,FilteredDeps,ChangedPrecision,ChangedRecall,Changedf2,ChangedPrecisionDeps,ChangedRecallDeps,Changedf2Deps
https://github.com/alphagov/e-petitions,356,"[app/controllers/admin/petitions_controller.rb, app/models/petition.rb, app/views/admin/petitions/edit_response.html.erb, app/views/petitions/show.html.erb, db/migrate/20150612111204_add_petition_summary_to_petition.rb, db/structure.sql, features/admin/threshold.feature, features/step_definitions/moderation_steps.rb, features/step_definitions/petition_steps.rb, features/step_definitions/threshold_steps.rb, features/suzie_views_a_petition.feature, spec/controllers/admin/petitions_controller_spec.rb, spec/factories.rb, spec/models/petition_spec.rb, app/controllers/local_petitions_controller.rb, app/controllers/petitions_controller.rb, app/controllers/signatures_controller.rb, app/controllers/sponsors_controller.rb, app/lib/constituency_api.rb, app/models/constituency_petition_journal.rb, app/models/signature.rb, app/views/local_petitions/_search.html.erb, app/views/local_petitions/constituency_lookup_failed.html.erb, app/views/local_petitions/index.html.erb, app/views/local_petitions/no_postcode_provided.html.erb, app/views/static_pages/home.html.erb, config/locales/petitions.en-GB.yml, config/routes.rb, db/migrate/20150609111042_add_constituency_id_to_signatures.rb, db/migrate/20150610091149_create_constituency_petition_journals.rb, features/freya_searches_for_petitions_by_constituency.feature, features/step_definitions/constituency_search_steps.rb, features/step_definitions/search_steps.rb, features/step_definitions/signature_steps.rb, features/step_definitions/sponsor_steps.rb, features/support/constituency_api.rb, features/support/paths.rb, features/suzie_searches_by_free_text.feature, lib/postcode_sanitizer.rb, spec/controllers/local_petitions_controller_spec.rb, spec/controllers/petitions_controller_spec.rb, spec/controllers/signatures_controller_spec.rb, spec/controllers/sponsors_controller_spec.rb, spec/fixtures/constituency_api/no_mps.xml, spec/lib/constituency_api_spec.rb, spec/lib/postcode_sanitizer_spec.rb, spec/models/constituency_petition_journal_spec.rb, spec/models/signature_spec.rb, spec/routing/local_petitions_spec.rb, spec/support/constituency_api_helpers.rb]","[app/controllers/admin/petitions_controller.rb, app/controllers/admin/user_sessions_controller.rb, app/controllers/archived/petitions_controller.rb, app/controllers/petitions_controller.rb, app/controllers/sponsors_controller.rb, app/controllers/static_pages_controller.rb, app/lib/constituency_api.rb, app/models/admin_user.rb, app/models/archived_petition.rb, app/models/concerns/browseable.rb, app/models/petition.rb, app/models/signature.rb, app/models/sponsor.rb, app/models/staged/base/petition.rb, app/models/staged/petition_creator/petition.rb, app/models/staged/petition_creator/stages.rb, app/models/staged/petition_signer/stages.rb, app/views/admin/user_sessions/new.html.erb, app/views/archived/petitions/show.html.erb, app/views/local_petitions/_search.html.erb, app/views/petitions/_action_help.html.erb, app/views/petitions/_trending_petition.html.erb, app/views/petitions/check.html.erb, app/views/petitions/check_results.html.erb, app/views/petitions/index.html.erb, app/views/petitions/new.html.erb, app/views/petitions/show.html.erb, app/views/search/_filter_nav.html.erb, app/views/search/_result_list_footer.html.erb, app/views/search/_results.html.erb, app/views/search/_results_for_pre_create_petition.html.erb, app/views/search/_results_table.html.erb, app/views/shared/_about_petitions.html.erb, app/views/shared/_notification.html.erb, app/views/shared/_share_petition.html.erb, app/views/sponsors/show.html.erb, app/views/static_pages/help.html.erb, app/views/static_pages/home.html.erb, lib/health_check.rb]",[features/step_definitions/petition_steps.rb],"['app/controllers/admin/petitions_controller.rb', 'app/controllers/admin/user_sessions_controller.rb', 'app/controllers/archived/petitions_controller.rb', 'app/controllers/petitions_controller.rb', 'app/controllers/sponsors_controller.rb', 'app/controllers/static_pages_controller.rb', 'app/lib/constituency_api.rb', 'app/models/admin_user.rb', 'app/models/archived_petition.rb', 'app/models/concerns/browseable.rb', 'app/models/petition.rb', 'app/models/signature.rb', 'app/models/sponsor.rb', 'app/models/staged/base/petition.rb', 'app/models/staged/petition_creator/petition.rb', 'app/models/staged/petition_creator/stages.rb', 'app/models/staged/petition_signer/stages.rb', 'app/views/admin/user_sessions/new.html.erb', 'app/views/archived/petitions/show.html.erb', 'app/views/local_petitions/_search.html.erb', 'app/views/petitions/_action_help.html.erb', 'app/views/petitions/_trending_petition.html.erb', 'app/views/petitions/check.html.erb', 'app/views/petitions/check_results.html.erb', 'app/views/petitions/index.html.erb', 'app/views/petitions/new.html.erb', 'app/views/petitions/show.html.erb', 'app/views/search/_filter_nav.html.erb', 'app/views/search/_result_list_footer.html.erb', 'app/views/search/_results.html.erb', 'app/views/search/_results_for_pre_create_petition.html.erb', 'app/views/search/_results_table.html.erb', 'app/views/shared/_about_petitions.html.erb', 'app/views/shared/_notification.html.erb', 'app/views/shared/_share_petition.html.erb', 'app/views/sponsors/show.html.erb', 'app/views/static_pages/help.html.erb', 'app/views/static_pages/home.html.erb', 'lib/health_check.rb']",,0.23076923076923078,0.18,0.1882845188284519,0.23076923076923078,0.18,0.1882845188284519,"['app/controllers/admin/petitions_controller.rb', 'app/models/petition.rb', 'app/views/admin/petitions/edit_response.html.erb', 'app/views/petitions/show.html.erb', 'app/controllers/local_petitions_controller.rb', 'app/controllers/petitions_controller.rb', 'app/controllers/signatures_controller.rb', 'app/controllers/sponsors_controller.rb', 'app/lib/constituency_api.rb', 'app/models/constituency_petition_journal.rb', 'app/models/signature.rb', 'app/views/local_petitions/_search.html.erb', 'app/views/local_petitions/constituency_lookup_failed.html.erb', 'app/views/local_petitions/index.html.erb', 'app/views/local_petitions/no_postcode_provided.html.erb', 'app/views/static_pages/home.html.erb', 'lib/postcode_sanitizer.rb']","['app/controllers/admin/petitions_controller.rb', 'app/controllers/admin/user_sessions_controller.rb', 'app/controllers/archived/petitions_controller.rb', 'app/controllers/petitions_controller.rb', 'app/controllers/sponsors_controller.rb', 'app/controllers/static_pages_controller.rb', 'app/lib/constituency_api.rb', 'app/models/admin_user.rb', 'app/models/archived_petition.rb', 'app/models/concerns/browseable.rb', 'app/models/petition.rb', 'app/models/signature.rb', 'app/models/sponsor.rb', 'app/models/staged/base/petition.rb', 'app/models/staged/petition_creator/petition.rb', 'app/models/staged/petition_creator/stages.rb', 'app/models/staged/petition_signer/stages.rb', 'app/views/admin/user_sessions/new.html.erb', 'app/views/archived/petitions/show.html.erb', 'app/views/local_petitions/_search.html.erb', 'app/views/petitions/_action_help.html.erb', 'app/views/petitions/_trending_petition.html.erb', 'app/views/petitions/check.html.erb', 'app/views/petitions/check_results.html.erb', 'app/views/petitions/index.html.erb', 'app/views/petitions/new.html.erb', 'app/views/petitions/show.html.erb', 'app/views/search/_filter_nav.html.erb', 'app/views/search/_result_list_footer.html.erb', 'app/views/search/_results.html.erb', 'app/views/search/_results_for_pre_create_petition.html.erb', 'app/views/search/_results_table.html.erb', 'app/views/shared/_about_petitions.html.erb', 'app/views/shared/_notification.html.erb', 'app/views/shared/_share_petition.html.erb', 'app/views/sponsors/show.html.erb', 'app/views/static_pages/help.html.erb', 'app/views/static_pages/home.html.erb', 'lib/health_check.rb']",,0.23076923076923078,0.5294117647058824,0.4205607476635514,0.23076923076923078,0.5294117647058824,0.4205607476635514
https://github.com/alphagov/e-petitions,359,"[app/assets/stylesheets/petitions/_buttons.scss, app/assets/stylesheets/petitions/_details.scss, app/assets/stylesheets/petitions/_forms.scss, app/assets/stylesheets/petitions/_panels.scss, app/assets/stylesheets/petitions/_typography.scss, app/assets/stylesheets/petitions/views/_petition-create.scss, app/assets/stylesheets/petitions/views/_shared.scss, app/assets/stylesheets/petitions/views/shared/_petition-item.scss, app/assets/stylesheets/site.scss, app/controllers/concerns/managing_move_parameter.rb, app/controllers/petitions_controller.rb, app/controllers/signatures_controller.rb, app/controllers/sponsors_controller.rb, app/helpers/petition_helper.rb, app/helpers/signature_helper.rb, app/models/staged/validations/petition_details.rb, app/views/petitions/_action_help.html.erb, app/views/petitions/_pre_creation_search_form.html.erb, app/views/petitions/check.html.erb, app/views/petitions/check_results.html.erb, app/views/petitions/create/_error_summary.html.erb, app/views/petitions/create/_petition_details_ui.html.erb, app/views/petitions/create/_replay_email_ui.html.erb, app/views/petitions/create/_replay_petition_ui.html.erb, app/views/petitions/create/_your_details_ui.html.erb, app/views/petitions/new.html.erb, app/views/petitions/thank_you.html.erb, app/views/search/_results_for_pre_create_petition.html.erb, app/views/signatures/_email.html.erb, app/views/signatures/_form.html.erb, app/views/signatures/create/_replay_email_ui.html.erb, app/views/signatures/create/_signer_ui.html.erb, app/views/static_pages/home.html.erb, features/charlie_creates_a_petition.feature, features/step_definitions/inspection_steps.rb, features/step_definitions/petition_steps.rb, spec/controllers/petitions_controller_spec.rb, spec/controllers/signatures_controller_spec.rb, spec/controllers/sponsors_controller_spec.rb, spec/models/petition_spec.rb]","[app/controllers/admin/petitions_controller.rb, app/controllers/archived/petitions_controller.rb, app/controllers/petitions_controller.rb, app/controllers/static_pages_controller.rb, app/lib/constituency_api.rb, app/models/petition.rb, app/models/signature.rb, app/models/staged/base/petition.rb, app/models/staged/base/signature.rb, app/models/staged/petition_creator/petition.rb, app/views/petitions/_action_help.html.erb, app/views/petitions/_trending_petition.html.erb, app/views/petitions/check.html.erb, app/views/petitions/check_results.html.erb, app/views/petitions/index.html.erb, app/views/petitions/new.html.erb, app/views/petitions/show.html.erb, app/views/search/_filter_nav.html.erb, app/views/search/_result_list_footer.html.erb, app/views/search/_results.html.erb, app/views/search/_results_for_pre_create_petition.html.erb, app/views/search/_results_table.html.erb, app/views/shared/_about_petitions.html.erb, app/views/shared/_notification.html.erb, app/views/shared/_share_petition.html.erb, app/views/static_pages/help.html.erb, app/views/static_pages/home.html.erb]",[features/charlie_creates_a_petition.feature],"['app/controllers/admin/petitions_controller.rb', 'app/controllers/archived/petitions_controller.rb', 'app/controllers/petitions_controller.rb', 'app/controllers/static_pages_controller.rb', 'app/lib/constituency_api.rb', 'app/models/petition.rb', 'app/models/signature.rb', 'app/models/staged/base/petition.rb', 'app/models/staged/base/signature.rb', 'app/models/staged/petition_creator/petition.rb', 'app/views/petitions/_action_help.html.erb', 'app/views/petitions/_trending_petition.html.erb', 'app/views/petitions/check.html.erb', 'app/views/petitions/check_results.html.erb', 'app/views/petitions/index.html.erb', 'app/views/petitions/new.html.erb', 'app/views/petitions/show.html.erb', 'app/views/search/_filter_nav.html.erb', 'app/views/search/_result_list_footer.html.erb', 'app/views/search/_results.html.erb', 'app/views/search/_results_for_pre_create_petition.html.erb', 'app/views/search/_results_table.html.erb', 'app/views/shared/_about_petitions.html.erb', 'app/views/shared/_notification.html.erb', 'app/views/shared/_share_petition.html.erb', 'app/views/static_pages/help.html.erb', 'app/views/static_pages/home.html.erb']",,0.25925925925925924,0.175,0.18716577540106952,0.25925925925925924,0.175,0.18716577540106952,"['app/controllers/concerns/managing_move_parameter.rb', 'app/controllers/petitions_controller.rb', 'app/controllers/signatures_controller.rb', 'app/controllers/sponsors_controller.rb', 'app/helpers/petition_helper.rb', 'app/helpers/signature_helper.rb', 'app/models/staged/validations/petition_details.rb', 'app/views/petitions/_action_help.html.erb', 'app/views/petitions/_pre_creation_search_form.html.erb', 'app/views/petitions/check.html.erb', 'app/views/petitions/check_results.html.erb', 'app/views/petitions/create/_error_summary.html.erb', 'app/views/petitions/create/_petition_details_ui.html.erb', 'app/views/petitions/create/_replay_email_ui.html.erb', 'app/views/petitions/create/_replay_petition_ui.html.erb', 'app/views/petitions/create/_your_details_ui.html.erb', 'app/views/petitions/new.html.erb', 'app/views/petitions/thank_you.html.erb', 'app/views/search/_results_for_pre_create_petition.html.erb', 'app/views/signatures/_email.html.erb', 'app/views/signatures/_form.html.erb', 'app/views/signatures/create/_replay_email_ui.html.erb', 'app/views/signatures/create/_signer_ui.html.erb', 'app/views/static_pages/home.html.erb']","['app/controllers/admin/petitions_controller.rb', 'app/controllers/archived/petitions_controller.rb', 'app/controllers/petitions_controller.rb', 'app/controllers/static_pages_controller.rb', 'app/lib/constituency_api.rb', 'app/models/petition.rb', 'app/models/signature.rb', 'app/models/staged/base/petition.rb', 'app/models/staged/base/signature.rb', 'app/models/staged/petition_creator/petition.rb', 'app/views/petitions/_action_help.html.erb', 'app/views/petitions/_trending_petition.html.erb', 'app/views/petitions/check.html.erb', 'app/views/petitions/check_results.html.erb', 'app/views/petitions/index.html.erb', 'app/views/petitions/new.html.erb', 'app/views/petitions/show.html.erb', 'app/views/search/_filter_nav.html.erb', 'app/views/search/_result_list_footer.html.erb', 'app/views/search/_results.html.erb', 'app/views/search/_results_for_pre_create_petition.html.erb', 'app/views/search/_results_table.html.erb', 'app/views/shared/_about_petitions.html.erb', 'app/views/shared/_notification.html.erb', 'app/views/shared/_share_petition.html.erb', 'app/views/static_pages/help.html.erb', 'app/views/static_pages/home.html.erb']",,0.25925925925925924,0.2916666666666667,0.2845528455284553,0.25925925925925924,0.2916666666666667,0.2845528455284553
https://github.com/alphagov/e-petitions,361,"[app/models/petition.rb, features/step_definitions/petition_steps.rb, app/models/concerns/browseable.rb, spec/models/concerns/browseable_spec.rb, spec/models/archived_petition_spec.rb, app/models/archived_petition.rb, app/views/petitions/index.html.erb, .gitignore, .travis.yml, Gemfile, Gemfile.lock, README.md, config/sunspot.yml, features/step_definitions/search_steps.rb, features/suzie_searches_by_free_text.feature, lib/tasks/epets.rake, solr/conf/admin-extra.html, solr/conf/elevate.xml, solr/conf/mapping-ISOLatin1Accent.txt, solr/conf/protwords.txt, solr/conf/schema.xml, solr/conf/scripts.conf, solr/conf/solrconfig.xml, solr/conf/spellings.txt, solr/conf/stopwords.txt, solr/conf/synonyms.txt, solr/solr.xml, app/helpers/search_helper.rb, spec/helpers/search_helper_spec.rb, app/controllers/petitions_controller.rb, app/controllers/search_controller.rb, app/views/petitions/_pre_creation_search_form.html.erb, app/views/petitions/check_results.html.erb, app/views/search/_filter_nav.html.erb, app/views/search/_result_list_footer.html.erb, app/views/search/_results.html.erb, app/views/search/_results_for_pre_create_petition.html.erb, app/views/search/_results_table.html.erb, app/views/search/search.html.erb, config/locales/petitions.en-GB.yml, features/joe_searches_for_an_archived_petition.feature, lib/health_check.rb, spec/lib/health_check_spec.rb, app/decorators/petition_search.rb, spec/decorators/petition_search_spec.rb, app/controllers/application_controller.rb, db/migrate/20150603112821_add_search_indexes_for_archived_petitions.rb, db/migrate/20150605100049_add_search_indexes_for_petitions.rb, db/structure.sql, lib/tasks/import.rake]","[app/controllers/admin/petitions_controller.rb, app/controllers/archived/petitions_controller.rb, app/controllers/petitions_controller.rb, app/controllers/static_pages_controller.rb, app/views/archived/petitions/index.html.erb, app/views/petitions/_pre_creation_search_form.html.erb, app/views/petitions/check.html.erb, app/views/petitions/check_results.html.erb, app/views/petitions/new.html.erb, app/views/petitions/show.html.erb, app/views/search/_results_for_pre_create_petition.html.erb, app/views/shared/_about_petitions.html.erb, app/views/shared/_share_petition.html.erb, app/views/static_pages/help.html.erb]",[features/step_definitions/petition_steps.rb],"['app/views/shared/_about_petitions.html.erb', 'app/controllers/static_pages_controller.rb', 'app/views/petitions/_pre_creation_search_form.html.erb', 'app/views/static_pages/help.html.erb', 'app/views/archived/petitions/index.html.erb', 'app/controllers/archived/petitions_controller.rb', 'app/views/search/_results_for_pre_create_petition.html.erb', 'app/controllers/petitions_controller.rb', 'app/views/shared/_share_petition.html.erb', 'app/views/petitions/new.html.erb', 'app/views/petitions/check_results.html.erb', 'app/views/petitions/show.html.erb', 'app/views/petitions/check.html.erb', 'app/controllers/admin/petitions_controller.rb']",,0.2857142857142857,0.08,0.09345794392523363,0.2857142857142857,0.08,0.09345794392523363,"['app/models/petition.rb', 'app/models/concerns/browseable.rb', 'app/models/archived_petition.rb', 'app/views/petitions/index.html.erb', 'app/helpers/search_helper.rb', 'app/controllers/petitions_controller.rb', 'app/controllers/search_controller.rb', 'app/views/petitions/_pre_creation_search_form.html.erb', 'app/views/petitions/check_results.html.erb', 'app/views/search/_filter_nav.html.erb', 'app/views/search/_result_list_footer.html.erb', 'app/views/search/_results.html.erb', 'app/views/search/_results_for_pre_create_petition.html.erb', 'app/views/search/_results_table.html.erb', 'app/views/search/search.html.erb', 'lib/health_check.rb', 'app/decorators/petition_search.rb', 'app/controllers/application_controller.rb']","['app/views/shared/_about_petitions.html.erb', 'app/controllers/static_pages_controller.rb', 'app/views/petitions/_pre_creation_search_form.html.erb', 'app/views/static_pages/help.html.erb', 'app/views/archived/petitions/index.html.erb', 'app/controllers/archived/petitions_controller.rb', 'app/views/search/_results_for_pre_create_petition.html.erb', 'app/controllers/petitions_controller.rb', 'app/views/shared/_share_petition.html.erb', 'app/views/petitions/new.html.erb', 'app/views/petitions/check_results.html.erb', 'app/views/petitions/show.html.erb', 'app/views/petitions/check.html.erb', 'app/controllers/admin/petitions_controller.rb']",,0.2857142857142857,0.2222222222222222,0.23255813953488366,0.2857142857142857,0.2222222222222222,0.23255813953488366
https://github.com/alphagov/e-petitions,365,"[app/assets/stylesheets/petitions/views/_shared.scss, app/controllers/petitions_controller.rb, app/views/search/_results_table.html.erb, features/suzie_views_all_petitions.feature]","[app/controllers/admin/petitions_controller.rb, app/controllers/archived/petitions_controller.rb, app/controllers/petitions_controller.rb, app/controllers/static_pages_controller.rb, app/models/petition.rb, app/models/staged/base/petition.rb, app/models/staged/petition_creator/petition.rb, app/views/petitions/_pre_creation_search_form.html.erb, app/views/petitions/_trending_petition.html.erb, app/views/petitions/check.html.erb, app/views/petitions/check_results.html.erb, app/views/petitions/index.html.erb, app/views/petitions/new.html.erb, app/views/petitions/show.html.erb, app/views/search/_filter_nav.html.erb, app/views/search/_result_list_footer.html.erb, app/views/search/_results.html.erb, app/views/search/_results_for_pre_create_petition.html.erb, app/views/search/_results_table.html.erb, app/views/shared/_about_petitions.html.erb, app/views/shared/_share_petition.html.erb, app/views/static_pages/help.html.erb, app/views/static_pages/home.html.erb]",[features/step_definitions/petition_steps.rb],"['app/controllers/admin/petitions_controller.rb', 'app/controllers/archived/petitions_controller.rb', 'app/controllers/petitions_controller.rb', 'app/controllers/static_pages_controller.rb', 'app/models/petition.rb', 'app/models/staged/base/petition.rb', 'app/models/staged/petition_creator/petition.rb', 'app/views/petitions/_pre_creation_search_form.html.erb', 'app/views/petitions/_trending_petition.html.erb', 'app/views/petitions/check.html.erb', 'app/views/petitions/check_results.html.erb', 'app/views/petitions/index.html.erb', 'app/views/petitions/new.html.erb', 'app/views/petitions/show.html.erb', 'app/views/search/_filter_nav.html.erb', 'app/views/search/_result_list_footer.html.erb', 'app/views/search/_results.html.erb', 'app/views/search/_results_for_pre_create_petition.html.erb', 'app/views/search/_results_table.html.erb', 'app/views/shared/_about_petitions.html.erb', 'app/views/shared/_share_petition.html.erb', 'app/views/static_pages/help.html.erb', 'app/views/static_pages/home.html.erb']",,0.08695652173913043,0.5,0.2564102564102564,0.08695652173913043,0.5,0.2564102564102564,"['app/controllers/petitions_controller.rb', 'app/views/search/_results_table.html.erb']","['app/controllers/admin/petitions_controller.rb', 'app/controllers/archived/petitions_controller.rb', 'app/controllers/petitions_controller.rb', 'app/controllers/static_pages_controller.rb', 'app/models/petition.rb', 'app/models/staged/base/petition.rb', 'app/models/staged/petition_creator/petition.rb', 'app/views/petitions/_pre_creation_search_form.html.erb', 'app/views/petitions/_trending_petition.html.erb', 'app/views/petitions/check.html.erb', 'app/views/petitions/check_results.html.erb', 'app/views/petitions/index.html.erb', 'app/views/petitions/new.html.erb', 'app/views/petitions/show.html.erb', 'app/views/search/_filter_nav.html.erb', 'app/views/search/_result_list_footer.html.erb', 'app/views/search/_results.html.erb', 'app/views/search/_results_for_pre_create_petition.html.erb', 'app/views/search/_results_table.html.erb', 'app/views/shared/_about_petitions.html.erb', 'app/views/shared/_share_petition.html.erb', 'app/views/static_pages/help.html.erb', 'app/views/static_pages/home.html.erb']",,0.08695652173913043,1.0,0.3225806451612903,0.08695652173913043,1.0,0.3225806451612903
https://github.com/alphagov/e-petitions,371,"[app/controllers/admin/petitions_controller.rb, app/controllers/admin/todolist_controller.rb, app/models/petition.rb, app/views/admin/petitions/_petition_details.html.erb, app/views/admin/todolist/index.html.erb, public/stylesheets/admin.css, spec/controllers/admin/todolist_controller_spec.rb, app/models/concerns/state.rb, features/admin/todolist.feature, features/step_definitions/moderation_steps.rb, features/step_definitions/petition_steps.rb]","[app/controllers/admin/user_sessions_controller.rb, app/lib/app_config.rb, app/models/petition.rb, app/models/staged/base/petition.rb, app/models/staged/petition_creator/petition.rb, app/views/admin/user_sessions/new.html.erb]",[features/admin/moderator_responds_to_petition.feature],"['app/controllers/admin/user_sessions_controller.rb', 'app/lib/app_config.rb', 'app/models/petition.rb', 'app/models/staged/base/petition.rb', 'app/models/staged/petition_creator/petition.rb', 'app/views/admin/user_sessions/new.html.erb']",,0.16666666666666666,0.09090909090909091,0.1,0.16666666666666666,0.09090909090909091,0.1,"['app/controllers/admin/petitions_controller.rb', 'app/controllers/admin/todolist_controller.rb', 'app/models/petition.rb', 'app/views/admin/petitions/_petition_details.html.erb', 'app/views/admin/todolist/index.html.erb', 'app/models/concerns/state.rb']","['app/controllers/admin/user_sessions_controller.rb', 'app/lib/app_config.rb', 'app/models/petition.rb', 'app/models/staged/base/petition.rb', 'app/models/staged/petition_creator/petition.rb', 'app/views/admin/user_sessions/new.html.erb']",,0.16666666666666666,0.16666666666666666,0.16666666666666666,0.16666666666666666,0.16666666666666666,0.16666666666666666
