Project,Task,Changed files,TestI,TextI,TestIWithDeps,IsolatedDeps,Precision,Recall,F2,PrecisionDeps,RecallDeps,F2Deps,ProductionChangedFiles,TestIwithFilteredDeps,FilteredDeps,ChangedPrecision,ChangedRecall,Changedf2,ChangedPrecisionDeps,ChangedRecallDeps,Changedf2Deps
https://github.com/alphagov/e-petitions,332,"[app/helpers/petition_helper.rb, app/models/petition.rb, app/models/signature.rb, app/views/search/petitions/_petition_result_for_facet_all.html.erb, app/views/search/petitions/_petition_result_for_facet_awaiting_response.html.erb, app/views/search/petitions/_petition_result_for_facet_closed.html.erb, app/views/search/petitions/_petition_result_for_facet_open.html.erb, app/views/search/petitions/_petition_result_for_facet_rejected.html.erb, app/views/search/petitions/_petition_result_for_facet_with_debate_outcome.html.erb, app/views/search/petitions/_petition_result_for_facet_with_response.html.erb, app/views/search/petitions/shared/_petition_action_link.html.erb, app/views/search/petitions/shared/_signature_count.html.erb, config/locales/petitions.en-GB.yml, db/migrate/20150619075903_add_response_threshold_reached_at_to_petition.rb, db/structure.sql, features/step_definitions/petition_steps.rb, features/suzie_views_all_petitions.feature, spec/factories.rb, spec/helpers/petition_helper_spec.rb, spec/models/petition_spec.rb, spec/controllers/admin/petitions_controller_spec.rb, spec/controllers/admin/profile_controller_spec.rb, config/schedule.rb, db/migrate/20150618233548_add_validated_at_to_signatures.rb, db/migrate/20150618233718_add_last_signed_at_to_petitions.rb, features/admin/threshold.feature, features/sam_signs_a_petition_with_suzies_email_address.feature, features/step_definitions/constituency_search_steps.rb, features/step_definitions/signature_steps.rb, features/suzie_searches_by_free_text.feature, features/suzie_signs_a_petition.feature, features/suzie_unsubscribes_from_petition_updates.feature, lib/tasks/data-generator.rake, spec/models/signature_spec.rb, app/controllers/signatures_controller.rb, app/controllers/sponsors_controller.rb, spec/controllers/sponsors_controller_spec.rb, app/models/site.rb, spec/models/site_spec.rb]","[app/controllers/admin/petitions_controller.rb, app/controllers/archived/petitions_controller.rb, app/controllers/petitions_controller.rb, app/controllers/search_controller.rb, app/controllers/static_pages_controller.rb, app/lib/constituency_api.rb, app/models/admin_user.rb, app/models/archived_petition.rb, app/models/concerns/browseable.rb, app/models/petition.rb, app/models/signature.rb, app/models/site.rb, app/models/staged/base/petition.rb, app/models/staged/base/signature.rb, app/models/staged/petition_creator/petition.rb, app/models/staged/petition_creator/stages.rb, app/models/staged/petition_signer/stages.rb, app/views/local_petitions/_search.html.erb, app/views/petitions/_action_help.html.erb, app/views/petitions/_petition_show.html.erb, app/views/petitions/_rejected_petition_show.html.erb, app/views/petitions/_threshold_details.html.erb, app/views/petitions/_trending_petition.html.erb, app/views/petitions/check.html.erb, app/views/petitions/check_results.html.erb, app/views/petitions/index.html.erb, app/views/petitions/new.html.erb, app/views/petitions/show.html.erb, app/views/search/_filter_nav.html.erb, app/views/search/_result_list_footer.html.erb, app/views/search/_results.html.erb, app/views/search/_results_for_pre_create_petition.html.erb, app/views/search/_results_table.html.erb, app/views/search/search.html.erb, app/views/shared/_notification.html.erb, app/views/shared/_share_petition.html.erb, app/views/static_pages/help.html.erb, app/views/static_pages/home.html.erb, lib/health_check.rb]","[features/step_definitions/petition_steps.rb, features/step_definitions/signature_steps.rb, features/suzie_searches_by_free_text.feature]","['app/controllers/admin/petitions_controller.rb', 'app/controllers/archived/petitions_controller.rb', 'app/controllers/petitions_controller.rb', 'app/controllers/search_controller.rb', 'app/controllers/static_pages_controller.rb', 'app/lib/constituency_api.rb', 'app/models/admin_user.rb', 'app/models/archived_petition.rb', 'app/models/concerns/browseable.rb', 'app/models/petition.rb', 'app/models/signature.rb', 'app/models/site.rb', 'app/models/staged/base/petition.rb', 'app/models/staged/base/signature.rb', 'app/models/staged/petition_creator/petition.rb', 'app/models/staged/petition_creator/stages.rb', 'app/models/staged/petition_signer/stages.rb', 'app/views/local_petitions/_search.html.erb', 'app/views/petitions/_action_help.html.erb', 'app/views/petitions/_petition_show.html.erb', 'app/views/petitions/_rejected_petition_show.html.erb', 'app/views/petitions/_threshold_details.html.erb', 'app/views/petitions/_trending_petition.html.erb', 'app/views/petitions/check.html.erb', 'app/views/petitions/check_results.html.erb', 'app/views/petitions/index.html.erb', 'app/views/petitions/new.html.erb', 'app/views/petitions/show.html.erb', 'app/views/search/_filter_nav.html.erb', 'app/views/search/_result_list_footer.html.erb', 'app/views/search/_results.html.erb', 'app/views/search/_results_for_pre_create_petition.html.erb', 'app/views/search/_results_table.html.erb', 'app/views/search/search.html.erb', 'app/views/shared/_notification.html.erb', 'app/views/shared/_share_petition.html.erb', 'app/views/static_pages/help.html.erb', 'app/views/static_pages/home.html.erb', 'lib/health_check.rb']",,0.07692307692307693,0.07692307692307693,0.07692307692307693,0.07692307692307693,0.07692307692307693,0.07692307692307693,"['app/helpers/petition_helper.rb', 'app/models/petition.rb', 'app/models/signature.rb', 'app/views/search/petitions/_petition_result_for_facet_all.html.erb', 'app/views/search/petitions/_petition_result_for_facet_awaiting_response.html.erb', 'app/views/search/petitions/_petition_result_for_facet_closed.html.erb', 'app/views/search/petitions/_petition_result_for_facet_open.html.erb', 'app/views/search/petitions/_petition_result_for_facet_rejected.html.erb', 'app/views/search/petitions/_petition_result_for_facet_with_debate_outcome.html.erb', 'app/views/search/petitions/_petition_result_for_facet_with_response.html.erb', 'app/views/search/petitions/shared/_petition_action_link.html.erb', 'app/views/search/petitions/shared/_signature_count.html.erb', 'app/controllers/signatures_controller.rb', 'app/controllers/sponsors_controller.rb', 'app/models/site.rb']","['app/controllers/admin/petitions_controller.rb', 'app/controllers/archived/petitions_controller.rb', 'app/controllers/petitions_controller.rb', 'app/controllers/search_controller.rb', 'app/controllers/static_pages_controller.rb', 'app/lib/constituency_api.rb', 'app/models/admin_user.rb', 'app/models/archived_petition.rb', 'app/models/concerns/browseable.rb', 'app/models/petition.rb', 'app/models/signature.rb', 'app/models/site.rb', 'app/models/staged/base/petition.rb', 'app/models/staged/base/signature.rb', 'app/models/staged/petition_creator/petition.rb', 'app/models/staged/petition_creator/stages.rb', 'app/models/staged/petition_signer/stages.rb', 'app/views/local_petitions/_search.html.erb', 'app/views/petitions/_action_help.html.erb', 'app/views/petitions/_petition_show.html.erb', 'app/views/petitions/_rejected_petition_show.html.erb', 'app/views/petitions/_threshold_details.html.erb', 'app/views/petitions/_trending_petition.html.erb', 'app/views/petitions/check.html.erb', 'app/views/petitions/check_results.html.erb', 'app/views/petitions/index.html.erb', 'app/views/petitions/new.html.erb', 'app/views/petitions/show.html.erb', 'app/views/search/_filter_nav.html.erb', 'app/views/search/_result_list_footer.html.erb', 'app/views/search/_results.html.erb', 'app/views/search/_results_for_pre_create_petition.html.erb', 'app/views/search/_results_table.html.erb', 'app/views/search/search.html.erb', 'app/views/shared/_notification.html.erb', 'app/views/shared/_share_petition.html.erb', 'app/views/static_pages/help.html.erb', 'app/views/static_pages/home.html.erb', 'lib/health_check.rb']",,0.07692307692307693,0.2,0.15151515151515152,0.07692307692307693,0.2,0.15151515151515152
https://github.com/alphagov/e-petitions,337,"[app/assets/javascripts/application.js, app/assets/javascripts/core.js, app/models/petition.rb, app/views/search/petitions/_petition_result_for_facet_with_debate_outcome.html.erb, config/locales/petitions.en-GB.yml, features/step_definitions/debate_outcome_steps.rb, features/suzie_views_a_petition.feature, features/suzie_views_all_petitions.feature, spec/models/petition_spec.rb]","[app/controllers/admin/petitions_controller.rb, app/controllers/archived/petitions_controller.rb, app/controllers/petitions_controller.rb, app/controllers/static_pages_controller.rb, app/models/archived_petition.rb, app/models/petition.rb, app/models/staged/base/petition.rb, app/models/staged/petition_creator/petition.rb, app/views/archived/petitions/show.html.erb, app/views/local_petitions/_search.html.erb, app/views/petitions/_action_help.html.erb, app/views/petitions/_petition_show.html.erb, app/views/petitions/_rejected_petition_show.html.erb, app/views/petitions/_threshold_details.html.erb, app/views/petitions/_trending_petition.html.erb, app/views/petitions/check.html.erb, app/views/petitions/check_results.html.erb, app/views/petitions/index.html.erb, app/views/petitions/new.html.erb, app/views/petitions/show.html.erb, app/views/search/_filter_nav.html.erb, app/views/search/_result_list_footer.html.erb, app/views/search/_results.html.erb, app/views/search/_results_for_pre_create_petition.html.erb, app/views/search/_results_table.html.erb, app/views/shared/_notification.html.erb, app/views/shared/_share_petition.html.erb, app/views/static_pages/help.html.erb, app/views/static_pages/home.html.erb]",[features/suzie_views_all_petitions.feature],"['app/controllers/admin/petitions_controller.rb', 'app/controllers/archived/petitions_controller.rb', 'app/controllers/petitions_controller.rb', 'app/controllers/static_pages_controller.rb', 'app/models/archived_petition.rb', 'app/models/petition.rb', 'app/models/staged/base/petition.rb', 'app/models/staged/petition_creator/petition.rb', 'app/views/archived/petitions/show.html.erb', 'app/views/local_petitions/_search.html.erb', 'app/views/petitions/_action_help.html.erb', 'app/views/petitions/_petition_show.html.erb', 'app/views/petitions/_rejected_petition_show.html.erb', 'app/views/petitions/_threshold_details.html.erb', 'app/views/petitions/_trending_petition.html.erb', 'app/views/petitions/check.html.erb', 'app/views/petitions/check_results.html.erb', 'app/views/petitions/index.html.erb', 'app/views/petitions/new.html.erb', 'app/views/petitions/show.html.erb', 'app/views/search/_filter_nav.html.erb', 'app/views/search/_result_list_footer.html.erb', 'app/views/search/_results.html.erb', 'app/views/search/_results_for_pre_create_petition.html.erb', 'app/views/search/_results_table.html.erb', 'app/views/shared/_notification.html.erb', 'app/views/shared/_share_petition.html.erb', 'app/views/static_pages/help.html.erb', 'app/views/static_pages/home.html.erb']",,0.034482758620689655,0.1111111111111111,0.07692307692307691,0.034482758620689655,0.1111111111111111,0.07692307692307691,"['app/models/petition.rb', 'app/views/search/petitions/_petition_result_for_facet_with_debate_outcome.html.erb']","['app/controllers/admin/petitions_controller.rb', 'app/controllers/archived/petitions_controller.rb', 'app/controllers/petitions_controller.rb', 'app/controllers/static_pages_controller.rb', 'app/models/archived_petition.rb', 'app/models/petition.rb', 'app/models/staged/base/petition.rb', 'app/models/staged/petition_creator/petition.rb', 'app/views/archived/petitions/show.html.erb', 'app/views/local_petitions/_search.html.erb', 'app/views/petitions/_action_help.html.erb', 'app/views/petitions/_petition_show.html.erb', 'app/views/petitions/_rejected_petition_show.html.erb', 'app/views/petitions/_threshold_details.html.erb', 'app/views/petitions/_trending_petition.html.erb', 'app/views/petitions/check.html.erb', 'app/views/petitions/check_results.html.erb', 'app/views/petitions/index.html.erb', 'app/views/petitions/new.html.erb', 'app/views/petitions/show.html.erb', 'app/views/search/_filter_nav.html.erb', 'app/views/search/_result_list_footer.html.erb', 'app/views/search/_results.html.erb', 'app/views/search/_results_for_pre_create_petition.html.erb', 'app/views/search/_results_table.html.erb', 'app/views/shared/_notification.html.erb', 'app/views/shared/_share_petition.html.erb', 'app/views/static_pages/help.html.erb', 'app/views/static_pages/home.html.erb']",,0.034482758620689655,0.5,0.13513513513513514,0.034482758620689655,0.5,0.13513513513513514
https://github.com/alphagov/e-petitions,338,"[app/controllers/admin/petition_details_controller.rb, spec/controllers/admin/petition_details_controller_spec.rb, app/models/petition.rb, app/views/admin/petition_details/show.html.erb, app/views/admin/petitions/edit.html.erb, config/routes.rb, features/step_definitions/moderation_steps.rb, spec/models/petition_spec.rb, features/admin/moderator_responds_to_petition.feature]","[app/controllers/admin/petition_details_controller.rb, app/controllers/admin/petitions_controller.rb, app/controllers/admin/user_sessions_controller.rb, app/controllers/archived/petitions_controller.rb, app/controllers/petitions_controller.rb, app/models/petition.rb, app/models/staged/base/petition.rb, app/models/staged/petition_creator/petition.rb, app/views/admin/petition_details/show.html.erb, app/views/admin/petitions/_internal_response.html.erb, app/views/admin/petitions/_petition_details.html.erb, app/views/admin/petitions/_published_petition_details.html.erb, app/views/admin/petitions/_reject.html.erb, app/views/admin/petitions/edit.html.erb, app/views/admin/petitions/edit_response.html.erb, app/views/admin/user_sessions/new.html.erb]","[app/controllers/petitions_controller.rb, app/models/staged/validations/petition_details.rb, app/views/petitions/create/_petition_details_ui.html.erb, features/charlie_creates_a_petition.feature, spec/controllers/petitions_controller_spec.rb, spec/models/petition_spec.rb]","['app/controllers/admin/petition_details_controller.rb', 'app/controllers/admin/petitions_controller.rb', 'app/controllers/admin/user_sessions_controller.rb', 'app/controllers/archived/petitions_controller.rb', 'app/controllers/petitions_controller.rb', 'app/models/petition.rb', 'app/models/staged/base/petition.rb', 'app/models/staged/petition_creator/petition.rb', 'app/views/admin/petition_details/show.html.erb', 'app/views/admin/petitions/_internal_response.html.erb', 'app/views/admin/petitions/_petition_details.html.erb', 'app/views/admin/petitions/_published_petition_details.html.erb', 'app/views/admin/petitions/_reject.html.erb', 'app/views/admin/petitions/edit.html.erb', 'app/views/admin/petitions/edit_response.html.erb', 'app/views/admin/user_sessions/new.html.erb']",,0.25,0.4444444444444444,0.38461538461538464,0.25,0.4444444444444444,0.38461538461538464,"['app/controllers/admin/petition_details_controller.rb', 'app/models/petition.rb', 'app/views/admin/petition_details/show.html.erb', 'app/views/admin/petitions/edit.html.erb']","['app/controllers/admin/petition_details_controller.rb', 'app/controllers/admin/petitions_controller.rb', 'app/controllers/admin/user_sessions_controller.rb', 'app/controllers/archived/petitions_controller.rb', 'app/controllers/petitions_controller.rb', 'app/models/petition.rb', 'app/models/staged/base/petition.rb', 'app/models/staged/petition_creator/petition.rb', 'app/views/admin/petition_details/show.html.erb', 'app/views/admin/petitions/_internal_response.html.erb', 'app/views/admin/petitions/_petition_details.html.erb', 'app/views/admin/petitions/_published_petition_details.html.erb', 'app/views/admin/petitions/_reject.html.erb', 'app/views/admin/petitions/edit.html.erb', 'app/views/admin/petitions/edit_response.html.erb', 'app/views/admin/user_sessions/new.html.erb']",,0.25,1.0,0.625,0.25,1.0,0.625
https://github.com/alphagov/e-petitions,340,"[features/step_definitions/petition_steps.rb, app/views/admin/petitions/show.html.erb, features/admin/providing_debate_outcome_information.feature, app/models/petition.rb, app/views/search/petitions/_petition_result_for_facet_with_response.html.erb, db/structure.sql, features/admin/petition_requires_response.feature, features/admin/takedown.feature, features/suzie_views_all_petitions.feature, spec/models/petition_spec.rb]","[app/controllers/admin/petitions_controller.rb, app/controllers/admin/user_sessions_controller.rb, app/controllers/archived/petitions_controller.rb, app/controllers/petitions_controller.rb, app/controllers/static_pages_controller.rb, app/models/petition.rb, app/models/staged/base/petition.rb, app/models/staged/petition_creator/petition.rb, app/views/admin/user_sessions/new.html.erb, app/views/local_petitions/_search.html.erb, app/views/petitions/_action_help.html.erb, app/views/petitions/_petition_show.html.erb, app/views/petitions/_rejected_petition_show.html.erb, app/views/petitions/_threshold_details.html.erb, app/views/petitions/_trending_petition.html.erb, app/views/petitions/check.html.erb, app/views/petitions/check_results.html.erb, app/views/petitions/index.html.erb, app/views/petitions/new.html.erb, app/views/petitions/show.html.erb, app/views/search/_filter_nav.html.erb, app/views/search/_result_list_footer.html.erb, app/views/search/_results.html.erb, app/views/search/_results_for_pre_create_petition.html.erb, app/views/search/_results_table.html.erb, app/views/shared/_notification.html.erb, app/views/shared/_share_petition.html.erb, app/views/static_pages/help.html.erb, app/views/static_pages/home.html.erb]","[features/admin/moderator_responds_to_petition.feature, features/admin/reports.feature, features/charlie_creates_a_petition.feature, features/step_definitions/moderation_steps.rb, features/step_definitions/petition_steps.rb, spec/controllers/admin/petitions_controller_spec.rb, spec/models/petition_spec.rb]","['app/controllers/admin/petitions_controller.rb', 'app/controllers/admin/user_sessions_controller.rb', 'app/controllers/archived/petitions_controller.rb', 'app/controllers/petitions_controller.rb', 'app/controllers/static_pages_controller.rb', 'app/models/petition.rb', 'app/models/staged/base/petition.rb', 'app/models/staged/petition_creator/petition.rb', 'app/views/admin/user_sessions/new.html.erb', 'app/views/local_petitions/_search.html.erb', 'app/views/petitions/_action_help.html.erb', 'app/views/petitions/_petition_show.html.erb', 'app/views/petitions/_rejected_petition_show.html.erb', 'app/views/petitions/_threshold_details.html.erb', 'app/views/petitions/_trending_petition.html.erb', 'app/views/petitions/check.html.erb', 'app/views/petitions/check_results.html.erb', 'app/views/petitions/index.html.erb', 'app/views/petitions/new.html.erb', 'app/views/petitions/show.html.erb', 'app/views/search/_filter_nav.html.erb', 'app/views/search/_result_list_footer.html.erb', 'app/views/search/_results.html.erb', 'app/views/search/_results_for_pre_create_petition.html.erb', 'app/views/search/_results_table.html.erb', 'app/views/shared/_notification.html.erb', 'app/views/shared/_share_petition.html.erb', 'app/views/static_pages/help.html.erb', 'app/views/static_pages/home.html.erb']",,0.034482758620689655,0.1,0.07246376811594205,0.034482758620689655,0.1,0.07246376811594205,"['app/views/admin/petitions/show.html.erb', 'app/models/petition.rb', 'app/views/search/petitions/_petition_result_for_facet_with_response.html.erb']","['app/controllers/admin/petitions_controller.rb', 'app/controllers/admin/user_sessions_controller.rb', 'app/controllers/archived/petitions_controller.rb', 'app/controllers/petitions_controller.rb', 'app/controllers/static_pages_controller.rb', 'app/models/petition.rb', 'app/models/staged/base/petition.rb', 'app/models/staged/petition_creator/petition.rb', 'app/views/admin/user_sessions/new.html.erb', 'app/views/local_petitions/_search.html.erb', 'app/views/petitions/_action_help.html.erb', 'app/views/petitions/_petition_show.html.erb', 'app/views/petitions/_rejected_petition_show.html.erb', 'app/views/petitions/_threshold_details.html.erb', 'app/views/petitions/_trending_petition.html.erb', 'app/views/petitions/check.html.erb', 'app/views/petitions/check_results.html.erb', 'app/views/petitions/index.html.erb', 'app/views/petitions/new.html.erb', 'app/views/petitions/show.html.erb', 'app/views/search/_filter_nav.html.erb', 'app/views/search/_result_list_footer.html.erb', 'app/views/search/_results.html.erb', 'app/views/search/_results_for_pre_create_petition.html.erb', 'app/views/search/_results_table.html.erb', 'app/views/shared/_notification.html.erb', 'app/views/shared/_share_petition.html.erb', 'app/views/static_pages/help.html.erb', 'app/views/static_pages/home.html.erb']",,0.034482758620689655,0.3333333333333333,0.12195121951219512,0.034482758620689655,0.3333333333333333,0.12195121951219512
