Project,Task,Changed files,TestI,TextI,TestIWithDeps,IsolatedDeps,Precision,Recall,F2,PrecisionDeps,RecallDeps,F2Deps,ProductionChangedFiles,TestIwithFilteredDeps,FilteredDeps,ChangedPrecision,ChangedRecall,Changedf2,ChangedPrecisionDeps,ChangedRecallDeps,Changedf2Deps
https://github.com/alphagov/e-petitions,287,"[app/controllers/pages_controller.rb, app/controllers/static_pages_controller.rb, app/helpers/application_helper.rb, app/helpers/home_helper.rb, app/helpers/page_title_helper.rb, app/models/archived_petition.rb, app/models/petition.rb, app/views/application/_analytics.html.erb, app/views/application/_footer.html.erb, app/views/application/_header.html.erb, app/views/application/_messages.html.erb, app/views/application/_notification.html.erb, app/views/application/_os.html.erb, app/views/application/_share_petition.html.erb, app/views/application/_social_meta.html.erb, app/views/archived/petitions/index.html.erb, app/views/archived/petitions/show.html.erb, app/views/feedback/index.html.erb, app/views/feedback/thanks.html.erb, app/views/layouts/application.html.erb, app/views/local_petitions/index.html.erb, app/views/pages/help.html.erb, app/views/pages/index.html.erb, app/views/petitions/_open_petition_show.html.erb, app/views/petitions/_trending_petition.html.erb, app/views/petitions/check.html.erb, app/views/petitions/check_results.html.erb, app/views/petitions/create/_replay_email_ui.html.erb, app/views/petitions/create/_replay_petition_ui.html.erb, app/views/petitions/index.html.erb, app/views/petitions/moderation_info.html.erb, app/views/petitions/new.html.erb, app/views/petitions/resend_confirmation_email.html.erb, app/views/petitions/show.html.erb, app/views/petitions/thank_you.html.erb, app/views/shared/_messages.html.erb, app/views/signatures/new.html.erb, app/views/signatures/signed.html.erb, app/views/signatures/thank_you.html.erb, app/views/signatures/unsubscribe/already_unsubscribed.html.erb, app/views/signatures/unsubscribe/failed_to_unsubscribe.html.erb, app/views/signatures/unsubscribe/successfully_unsubscribed.html.erb, app/views/sponsors/show.html.erb, app/views/sponsors/sponsored.html.erb, app/views/sponsors/thank_you.html.erb, config/locales/page_titles.en-GB.yml, config/routes.rb, features/step_definitions/trending_steps.rb, features/suzie_signs_a_petition.feature, spec/controllers/pages_controller_spec.rb, spec/controllers/static_pages_controller_spec.rb, spec/factories.rb, spec/helpers/application_helper_spec.rb, spec/helpers/page_title_helper_spec.rb, spec/models/petition_spec.rb, app/views/static_pages/home.html.erb, app/views/shared/_header.html.erb, app/views/static_pages/help.html.erb, .travis.yml, app/controllers/admin/petitions_controller.rb, app/controllers/admin/todolist_controller.rb, app/controllers/concerns/authentication.rb, app/views/admin/petitions/threshold.html.erb, app/views/admin/shared/_admin_nav.html.erb, app/views/admin/todolist/index.html.erb, app/views/admin_mailer/threshold_email_reminder.html.erb, app/views/admin_mailer/threshold_email_reminder.text.erb, config/locales/petitions.en-GB.yml, features/admin/admin_access.feature, features/admin/all_petitions.feature, features/admin/notes.feature, features/admin/threshold.feature, features/admin/todolist.feature, features/step_definitions/petition_steps.rb, features/support/paths.rb, features/suzie_searches_by_free_text.feature, spec/controllers/admin/petitions_controller_spec.rb, spec/controllers/admin/todolist_controller_spec.rb, spec/routing/admin/petitions_spec.rb]","[app/controllers/admin/petitions_controller.rb, app/controllers/admin/user_sessions_controller.rb, app/controllers/archived/petitions_controller.rb, app/controllers/petitions_controller.rb, app/lib/constituency_api.rb, app/models/admin_user.rb, app/models/concerns/browseable.rb, app/models/petition.rb, app/models/signature.rb, app/models/staged/base/petition.rb, app/models/staged/base/signature.rb, app/models/staged/petition_creator/petition.rb, app/models/staged/petition_creator/stages.rb, app/models/staged/petition_signer/stages.rb, app/views/admin/user_sessions/new.html.erb, app/views/petitions/_closed_petition_show.html.erb, app/views/petitions/_open_petition_show.html.erb, app/views/petitions/_rejected_petition_show.html.erb, app/views/petitions/_threshold_details.html.erb, app/views/petitions/show.html.erb, lib/health_check.rb]","[features/step_definitions/petition_steps.rb, features/suzie_signs_a_petition.feature, spec/controllers/admin/petitions_controller_spec.rb, spec/models/petition_spec.rb]","['app/controllers/admin/petitions_controller.rb', 'app/controllers/admin/user_sessions_controller.rb', 'app/controllers/archived/petitions_controller.rb', 'app/controllers/petitions_controller.rb', 'app/lib/constituency_api.rb', 'app/models/admin_user.rb', 'app/models/concerns/browseable.rb', 'app/models/petition.rb', 'app/models/signature.rb', 'app/models/staged/base/petition.rb', 'app/models/staged/base/signature.rb', 'app/models/staged/petition_creator/petition.rb', 'app/models/staged/petition_creator/stages.rb', 'app/models/staged/petition_signer/stages.rb', 'app/views/admin/user_sessions/new.html.erb', 'app/views/petitions/_closed_petition_show.html.erb', 'app/views/petitions/_open_petition_show.html.erb', 'app/views/petitions/_rejected_petition_show.html.erb', 'app/views/petitions/_threshold_details.html.erb', 'app/views/petitions/show.html.erb', 'lib/health_check.rb']",,0.19047619047619047,0.05063291139240506,0.05934718100890207,0.19047619047619047,0.05063291139240506,0.05934718100890207,"['app/controllers/pages_controller.rb', 'app/controllers/static_pages_controller.rb', 'app/helpers/application_helper.rb', 'app/helpers/home_helper.rb', 'app/helpers/page_title_helper.rb', 'app/models/archived_petition.rb', 'app/models/petition.rb', 'app/views/application/_analytics.html.erb', 'app/views/application/_footer.html.erb', 'app/views/application/_header.html.erb', 'app/views/application/_messages.html.erb', 'app/views/application/_notification.html.erb', 'app/views/application/_os.html.erb', 'app/views/application/_share_petition.html.erb', 'app/views/application/_social_meta.html.erb', 'app/views/archived/petitions/index.html.erb', 'app/views/archived/petitions/show.html.erb', 'app/views/feedback/index.html.erb', 'app/views/feedback/thanks.html.erb', 'app/views/layouts/application.html.erb', 'app/views/local_petitions/index.html.erb', 'app/views/pages/help.html.erb', 'app/views/pages/index.html.erb', 'app/views/petitions/_open_petition_show.html.erb', 'app/views/petitions/_trending_petition.html.erb', 'app/views/petitions/check.html.erb', 'app/views/petitions/check_results.html.erb', 'app/views/petitions/create/_replay_email_ui.html.erb', 'app/views/petitions/create/_replay_petition_ui.html.erb', 'app/views/petitions/index.html.erb', 'app/views/petitions/moderation_info.html.erb', 'app/views/petitions/new.html.erb', 'app/views/petitions/resend_confirmation_email.html.erb', 'app/views/petitions/show.html.erb', 'app/views/petitions/thank_you.html.erb', 'app/views/shared/_messages.html.erb', 'app/views/signatures/new.html.erb', 'app/views/signatures/signed.html.erb', 'app/views/signatures/thank_you.html.erb', 'app/views/signatures/unsubscribe/already_unsubscribed.html.erb', 'app/views/signatures/unsubscribe/failed_to_unsubscribe.html.erb', 'app/views/signatures/unsubscribe/successfully_unsubscribed.html.erb', 'app/views/sponsors/show.html.erb', 'app/views/sponsors/sponsored.html.erb', 'app/views/sponsors/thank_you.html.erb', 'app/views/static_pages/home.html.erb', 'app/views/shared/_header.html.erb', 'app/views/static_pages/help.html.erb', 'app/controllers/admin/petitions_controller.rb', 'app/controllers/admin/todolist_controller.rb', 'app/controllers/concerns/authentication.rb', 'app/views/admin/petitions/threshold.html.erb', 'app/views/admin/shared/_admin_nav.html.erb', 'app/views/admin/todolist/index.html.erb', 'app/views/admin_mailer/threshold_email_reminder.html.erb', 'app/views/admin_mailer/threshold_email_reminder.text.erb']","['app/controllers/admin/petitions_controller.rb', 'app/controllers/admin/user_sessions_controller.rb', 'app/controllers/archived/petitions_controller.rb', 'app/controllers/petitions_controller.rb', 'app/lib/constituency_api.rb', 'app/models/admin_user.rb', 'app/models/concerns/browseable.rb', 'app/models/petition.rb', 'app/models/signature.rb', 'app/models/staged/base/petition.rb', 'app/models/staged/base/signature.rb', 'app/models/staged/petition_creator/petition.rb', 'app/models/staged/petition_creator/stages.rb', 'app/models/staged/petition_signer/stages.rb', 'app/views/admin/user_sessions/new.html.erb', 'app/views/petitions/_closed_petition_show.html.erb', 'app/views/petitions/_open_petition_show.html.erb', 'app/views/petitions/_rejected_petition_show.html.erb', 'app/views/petitions/_threshold_details.html.erb', 'app/views/petitions/show.html.erb', 'lib/health_check.rb']",,0.19047619047619047,0.07142857142857142,0.08163265306122448,0.19047619047619047,0.07142857142857142,0.08163265306122448
https://github.com/alphagov/e-petitions,292,"[spec/models/archived_petition_spec.rb, app/views/archived/petitions/show.html.erb, features/joe_views_an_archived_petition.feature, app/views/archived/petitions/index.html.erb, config/locales/will_paginate.en-GB.yml]","[app/controllers/admin/petitions_controller.rb, app/controllers/archived/petitions_controller.rb, app/controllers/petitions_controller.rb, app/models/archived_petition.rb, app/models/petition.rb, app/models/staged/base/petition.rb, app/models/staged/petition_creator/petition.rb, app/views/archived/petitions/show.html.erb, app/views/petitions/_closed_petition_show.html.erb, app/views/petitions/_open_petition_show.html.erb, app/views/petitions/_rejected_petition_show.html.erb, app/views/petitions/_threshold_details.html.erb, app/views/petitions/show.html.erb, app/views/shared/_share_petition.html.erb]",[features/step_definitions/petition_steps.rb],"['app/controllers/admin/petitions_controller.rb', 'app/controllers/archived/petitions_controller.rb', 'app/controllers/petitions_controller.rb', 'app/models/archived_petition.rb', 'app/models/petition.rb', 'app/models/staged/base/petition.rb', 'app/models/staged/petition_creator/petition.rb', 'app/views/archived/petitions/show.html.erb', 'app/views/petitions/_closed_petition_show.html.erb', 'app/views/petitions/_open_petition_show.html.erb', 'app/views/petitions/_rejected_petition_show.html.erb', 'app/views/petitions/_threshold_details.html.erb', 'app/views/petitions/show.html.erb', 'app/views/shared/_share_petition.html.erb']",,0.07142857142857142,0.2,0.14705882352941177,0.07142857142857142,0.2,0.14705882352941177,"['app/views/archived/petitions/show.html.erb', 'app/views/archived/petitions/index.html.erb']","['app/controllers/admin/petitions_controller.rb', 'app/controllers/archived/petitions_controller.rb', 'app/controllers/petitions_controller.rb', 'app/models/archived_petition.rb', 'app/models/petition.rb', 'app/models/staged/base/petition.rb', 'app/models/staged/petition_creator/petition.rb', 'app/views/archived/petitions/show.html.erb', 'app/views/petitions/_closed_petition_show.html.erb', 'app/views/petitions/_open_petition_show.html.erb', 'app/views/petitions/_rejected_petition_show.html.erb', 'app/views/petitions/_threshold_details.html.erb', 'app/views/petitions/show.html.erb', 'app/views/shared/_share_petition.html.erb']",,0.07142857142857142,0.5,0.22727272727272724,0.07142857142857142,0.5,0.22727272727272724
https://github.com/alphagov/e-petitions,296,"[app/assets/stylesheets/petitions/views/_shared.scss, app/controllers/admin/debate_outcomes_controller.rb, app/controllers/admin/government_response_controller.rb, app/controllers/admin/petitions_controller.rb, app/helpers/admin_helper.rb, app/models/petition.rb, app/views/admin/debate_outcomes/show.html.erb, app/views/admin/government_response/show.html.erb, app/views/admin/petitions/edit_scheduled_debate_date.html.erb, app/views/layouts/admin.html.erb, features/admin/moderator_updates_petition_scheduled_debate_date.feature, features/admin/providing_debate_outcome_information.feature, features/admin/threshold.feature, features/step_definitions/moderation_steps.rb, features/support/paths.rb, public/javascripts/edit_response_controller.js, spec/controllers/admin/debate_outcomes_controller_spec.rb, spec/controllers/admin/government_response_controller_spec.rb, spec/javascripts/edit_response_controller_spec.js, spec/models/petition_spec.rb]","[app/controllers/admin/user_sessions_controller.rb, app/models/concerns/browseable.rb, app/models/petition.rb, app/models/site.rb, app/models/staged/base/petition.rb, app/models/staged/petition_creator/petition.rb, app/views/admin/user_sessions/new.html.erb]","[app/models/petition.rb, db/structure.sql, spec/models/petition_spec.rb]","['app/controllers/admin/user_sessions_controller.rb', 'app/models/concerns/browseable.rb', 'app/models/petition.rb', 'app/models/site.rb', 'app/models/staged/base/petition.rb', 'app/models/staged/petition_creator/petition.rb', 'app/views/admin/user_sessions/new.html.erb']",,0.14285714285714285,0.05,0.057471264367816084,0.14285714285714285,0.05,0.057471264367816084,"['app/controllers/admin/debate_outcomes_controller.rb', 'app/controllers/admin/government_response_controller.rb', 'app/controllers/admin/petitions_controller.rb', 'app/helpers/admin_helper.rb', 'app/models/petition.rb', 'app/views/admin/debate_outcomes/show.html.erb', 'app/views/admin/government_response/show.html.erb', 'app/views/admin/petitions/edit_scheduled_debate_date.html.erb', 'app/views/layouts/admin.html.erb']","['app/controllers/admin/user_sessions_controller.rb', 'app/models/concerns/browseable.rb', 'app/models/petition.rb', 'app/models/site.rb', 'app/models/staged/base/petition.rb', 'app/models/staged/petition_creator/petition.rb', 'app/views/admin/user_sessions/new.html.erb']",,0.14285714285714285,0.1111111111111111,0.11627906976744183,0.14285714285714285,0.1111111111111111,0.11627906976744183
https://github.com/alphagov/e-petitions,303,"[app/views/archived/petitions/index.html.erb, app/views/petitions/index.html.erb, app/views/petitions/search/_filter_nav.html.erb, features/joe_views_all_archived_petitions.feature, app/views/petitions/search/_result_list_footer.html.erb, app/views/petitions/search/_results.html.erb, spec/helpers/search_helper_spec.rb, app/controllers/archived/petitions_controller.rb, app/models/archived_petition.rb, app/views/archived/petitions/search.html.erb, config/routes.rb, features/joe_searches_for_an_archived_petition.feature, spec/routing/archived/petitions_spec.rb, app/assets/stylesheets/petitions/views/_search.scss, app/assets/stylesheets/petitions/views/_shared.scss, app/views/archived/petitions/show.html.erb, spec/models/archived_petition_spec.rb, features/joe_views_an_archived_petition.feature, features/step_definitions/inspection_steps.rb]","[app/controllers/admin/petitions_controller.rb, app/controllers/archived/petitions_controller.rb, app/controllers/petitions_controller.rb, app/controllers/static_pages_controller.rb, app/models/admin_user.rb, app/models/archived_petition.rb, app/models/concerns/browseable.rb, app/models/petition.rb, app/models/staged/base/petition.rb, app/models/staged/petition_creator/petition.rb, app/models/staged/petition_creator/stages.rb, app/models/staged/petition_signer/stages.rb, app/views/archived/petitions/index.html.erb, app/views/archived/petitions/show.html.erb, app/views/local_petitions/_search.html.erb, app/views/petitions/_action_help.html.erb, app/views/petitions/_closed_petition_show.html.erb, app/views/petitions/_open_petition_show.html.erb, app/views/petitions/_rejected_petition_show.html.erb, app/views/petitions/_threshold_details.html.erb, app/views/petitions/_trending_petition.html.erb, app/views/petitions/check.html.erb, app/views/petitions/check_results.html.erb, app/views/petitions/index.html.erb, app/views/petitions/new.html.erb, app/views/petitions/search/_filter_nav.html.erb, app/views/petitions/search/_result_list_footer.html.erb, app/views/petitions/search/_results.html.erb, app/views/petitions/search/_results_for_pre_create_petition.html.erb, app/views/petitions/show.html.erb, app/views/shared/_notification.html.erb, app/views/shared/_share_petition.html.erb, app/views/static_pages/home.html.erb]","[features/joe_searches_for_an_archived_petition.feature, features/step_definitions/petition_steps.rb]","['app/controllers/admin/petitions_controller.rb', 'app/controllers/archived/petitions_controller.rb', 'app/controllers/petitions_controller.rb', 'app/controllers/static_pages_controller.rb', 'app/models/admin_user.rb', 'app/models/archived_petition.rb', 'app/models/concerns/browseable.rb', 'app/models/petition.rb', 'app/models/staged/base/petition.rb', 'app/models/staged/petition_creator/petition.rb', 'app/models/staged/petition_creator/stages.rb', 'app/models/staged/petition_signer/stages.rb', 'app/views/archived/petitions/index.html.erb', 'app/views/archived/petitions/show.html.erb', 'app/views/local_petitions/_search.html.erb', 'app/views/petitions/_action_help.html.erb', 'app/views/petitions/_closed_petition_show.html.erb', 'app/views/petitions/_open_petition_show.html.erb', 'app/views/petitions/_rejected_petition_show.html.erb', 'app/views/petitions/_threshold_details.html.erb', 'app/views/petitions/_trending_petition.html.erb', 'app/views/petitions/check.html.erb', 'app/views/petitions/check_results.html.erb', 'app/views/petitions/index.html.erb', 'app/views/petitions/new.html.erb', 'app/views/petitions/search/_filter_nav.html.erb', 'app/views/petitions/search/_result_list_footer.html.erb', 'app/views/petitions/search/_results.html.erb', 'app/views/petitions/search/_results_for_pre_create_petition.html.erb', 'app/views/petitions/show.html.erb', 'app/views/shared/_notification.html.erb', 'app/views/shared/_share_petition.html.erb', 'app/views/static_pages/home.html.erb']",,0.24242424242424243,0.42105263157894735,0.36697247706422015,0.24242424242424243,0.42105263157894735,0.36697247706422015,"['app/views/archived/petitions/index.html.erb', 'app/views/petitions/index.html.erb', 'app/views/petitions/search/_filter_nav.html.erb', 'app/views/petitions/search/_result_list_footer.html.erb', 'app/views/petitions/search/_results.html.erb', 'app/controllers/archived/petitions_controller.rb', 'app/models/archived_petition.rb', 'app/views/archived/petitions/search.html.erb', 'app/views/archived/petitions/show.html.erb']","['app/controllers/admin/petitions_controller.rb', 'app/controllers/archived/petitions_controller.rb', 'app/controllers/petitions_controller.rb', 'app/controllers/static_pages_controller.rb', 'app/models/admin_user.rb', 'app/models/archived_petition.rb', 'app/models/concerns/browseable.rb', 'app/models/petition.rb', 'app/models/staged/base/petition.rb', 'app/models/staged/petition_creator/petition.rb', 'app/models/staged/petition_creator/stages.rb', 'app/models/staged/petition_signer/stages.rb', 'app/views/archived/petitions/index.html.erb', 'app/views/archived/petitions/show.html.erb', 'app/views/local_petitions/_search.html.erb', 'app/views/petitions/_action_help.html.erb', 'app/views/petitions/_closed_petition_show.html.erb', 'app/views/petitions/_open_petition_show.html.erb', 'app/views/petitions/_rejected_petition_show.html.erb', 'app/views/petitions/_threshold_details.html.erb', 'app/views/petitions/_trending_petition.html.erb', 'app/views/petitions/check.html.erb', 'app/views/petitions/check_results.html.erb', 'app/views/petitions/index.html.erb', 'app/views/petitions/new.html.erb', 'app/views/petitions/search/_filter_nav.html.erb', 'app/views/petitions/search/_result_list_footer.html.erb', 'app/views/petitions/search/_results.html.erb', 'app/views/petitions/search/_results_for_pre_create_petition.html.erb', 'app/views/petitions/show.html.erb', 'app/views/shared/_notification.html.erb', 'app/views/shared/_share_petition.html.erb', 'app/views/static_pages/home.html.erb']",,0.24242424242424243,0.8888888888888888,0.5797101449275363,0.24242424242424243,0.8888888888888888,0.5797101449275363
