Project,Task,Changed files,TestI,TextIhttps://github.com/sharetribe/sharetribe,2756,"[RELEASE_NOTES.md, VERSION, config/locales/es.yml, config/locales/faq/faq.es.yml, config/locales/faq/faq.sv.yml, config/locales/fi.yml, config/locales/ru.yml, config/application.rb, config/locales/ca.yml, config/locales/de.yml, config/locales/el.yml, config/locales/en.yml, config/locales/es-ES.yml, config/locales/fr.yml, config/locales/it.yml, config/locales/lv.yml, config/locales/nl.yml, config/locales/ro.yml, config/locales/sw.yml, config/locales/vi.yml, config/locales/zh.yml, app/controllers/settings_controller.rb, app/mailers/person_mailer.rb, app/models/person.rb, db/migrate/20121218125831_change_community_update_email_settings.rb, db/schema.rb, spec/controllers/settings_controller_spec.rb, .gitignore, app/models/listing_image.rb, public/system/paperclip_attachments.yml, app/views/person_mailer/_community_update_listing.html.haml, app/views/person_mailer/_community_update_listing_image_no_description.haml, config/locales/faq/faq.el.yml, app/views/dashboard/_footer.haml, app/assets/javascripts/kassi.js, app/assets/stylesheets/style.css.scss, app/views/settings/_community_updates_radiobutton.haml, app/views/settings/notifications.haml, features/settings/user_changes_notification_settings.feature, app/helpers/listings_helper.rb, app/controllers/application_controller.rb, app/helpers/application_helper.rb, app/views/settings/unsubscribe.haml, spec/controllers/application_controller_spec.rb, communities/default/about/about.ru.haml, config/locales/faq/faq.ru.yml, app/views/person_mailer/community_updates.html.haml, config/routes.rb, spec/controllers/people_controller_spec.rb, test/helper_modules.rb, spec/models/listing_spec.rb, Gemfile, Gemfile.lock, app/controllers/homepage_controller.rb, app/models/auth_token.rb, app/models/community.rb, db/migrate/20121212145626_create_auth_tokens.rb, db/migrate/20121214083430_add_community_updates_fields_to_people.rb, spec/mailers/person_mailer_spec.rb, spec/spec_helper.rb]","[app/controllers/application_controller.rb, app/controllers/dashboard_controller.rb, app/models/community.rb, app/models/community_membership.rb, app/models/person.rb, app/views/dashboard/_footer.haml, app/views/dashboard/_header.haml, app/views/dashboard/_lower_middle.haml, app/views/dashboard/api.haml, app/views/dashboard/faq.haml, app/views/dashboard/index.haml]",[config/locales/fi.yml]
https://github.com/sharetribe/sharetribe,2766,"[RELEASE_NOTES.md, VERSION, features/dashboard/user_views_dashboard.feature, app/helpers/application_helper.rb, lib/tasks/rspec.rake, communities/default/about/about.el.haml, config/locales/el.yml, config/locales/faq/faq.ca.yml, config/locales/faq/faq.de.yml, config/locales/faq/faq.el.yml, config/locales/faq/faq.es-ES.yml, config/locales/faq/faq.es.yml, config/locales/faq/faq.fr.yml, config/locales/faq/faq.it.yml, config/locales/faq/faq.lv.yml, config/locales/faq/faq.nl.yml, config/locales/faq/faq.ro.yml, config/locales/faq/faq.ru.yml, config/locales/faq/faq.sw.yml, config/locales/faq/faq.vi.yml, config/locales/faq/faq.zh.yml, app/mailers/person_mailer.rb, app/models/statistic.rb, app/models/community.rb, README.md, app/controllers/dashboard_controller.rb, app/views/communities/new.haml, app/views/dashboard/_header.haml, features/communities/user_creates_a_new_community.feature, app/assets/stylesheets/style_dashboard.css.scss, app/views/dashboard/faq.haml, app/views/dashboard/index.haml, config/locales/en.yml, config/locales/faq/faq.en.yml, config/locales/faq/faq.fi.yml, config/locales/fi.yml, app/assets/images/community_images/catedras_libres-logo.png, communities/catedraslibres/frontpage_sidebar/frontpage_sidebar.es.haml]","[app/controllers/application_controller.rb, app/controllers/dashboard_controller.rb, app/models/community.rb, app/models/person.rb, app/views/communities/_select_pricing_plan.haml, app/views/dashboard/_footer.haml, app/views/dashboard/_header.haml, app/views/dashboard/_lower_middle.haml, app/views/dashboard/api.haml, app/views/dashboard/faq.haml, app/views/dashboard/index.haml, app/views/dashboard/pricing.haml]","[app/controllers/communities_controller.rb, config/locales/en.yml, config/locales/fi.yml, features/communities/user_creates_a_new_community.feature]"
https://github.com/sharetribe/sharetribe,2781,"[RELEASE_NOTES.md, VERSION, app/controllers/communities_controller.rb, app/stylesheets/style_dashboard.scss, app/views/communities/_enter_organization_email.haml, app/views/communities/_new_tribe_form.haml, app/views/people/help_texts/_invite_only_help_text.haml, app/views/sessions/_new.haml, config/locales/en.yml, config/locales/fi.yml, features/communities/user_creates_a_new_community.feature, features/step_definitions/community_steps.rb, public/javascripts/kassi_dashboard.js, public/stylesheets/compiled/style_dashboard.css, lib/tasks/deploy.rake]","[app/controllers/application_controller.rb, app/controllers/dashboard_controller.rb, app/models/community.rb, app/models/person.rb, app/views/communities/_select_pricing_plan.haml, app/views/dashboard/_footer.haml, app/views/dashboard/_header.haml, app/views/dashboard/_lower_middle.haml, app/views/dashboard/api.haml, app/views/dashboard/faq.haml, app/views/dashboard/index.haml, app/views/dashboard/pricing.haml]",[app/models/person.rb]
https://github.com/sharetribe/sharetribe,2789,"[RELEASE_NOTES.md, VERSION, app/models/person.rb, app/models/testimonial.rb, app/mailers/person_mailer.rb, app/models/listing.rb, app/controllers/api/tokens_controller.rb, app/controllers/sessions_controller.rb, app/helpers/application_helper.rb, app/views/homepage/sign_in.haml, app/views/sessions/_new.haml, app/views/settings/account.haml, config/initializers/devise.rb, config/locales/en.yml, config/locales/fi.yml, features/sessions/facebook_connect.feature, features/step_definitions/user_steps.rb, public/javascripts/kassi.js, spec/controllers/api/tokens_controller_spec.rb, spec/controllers/sessions_controller_spec.rb]","[app/controllers/application_controller.rb, app/controllers/dashboard_controller.rb, app/controllers/sessions_controller.rb, app/models/community.rb, app/models/community_membership.rb, app/views/communities/_select_pricing_plan.haml, app/views/dashboard/_footer.haml, app/views/dashboard/_header.haml, app/views/dashboard/api.haml, app/views/dashboard/faq.haml, app/views/dashboard/pricing.haml, app/views/sessions/_new.haml, app/views/sessions/new.haml]",[features/people/user_creates_a_new_account.feature]
https://github.com/sharetribe/sharetribe,2797,"[app/controllers/application_controller.rb, config/config.example.yml, public/errors/maintenance.html, Gemfile, Gemfile.lock, config/application.rb, app/models/listing.rb, config/sphinx.yml, app/mailers/person_mailer.rb, Procfile, config/unicorn.rb, lib/console scripts/aalto_terms_reminder.rb, config/database.example.yml, config/environments/staging.rb, app/helpers/application_helper.rb, app/models/community.rb, app/views/communities/_new_tribe_form.haml, app/views/dashboard/_header.haml, app/views/layouts/private.haml, config/config_loader.rb, config/environment.rb, config/initializers/i18n.rb, features/common/user_changes_language.feature, features/communities/user_sees_available_locales.feature, features/dashboard/user_views_dashboard.feature, lib/tasks/i18n.rake, app/views/api/listings/index.atom.builder, app/controllers/people_controller.rb, app/controllers/sessions_controller.rb, config/environments/development.rb, config/environments/production.rb, lib/tasks/heroku.rake, app/models/listing_image.rb, app/models/person.rb, spec/models/cached_ressi_event_spec.rb, lib/tasks/excel.rake, config/initializers/01_load_config.rb, app/controllers/terms_controller.rb, app/models/asi_person.rb, app/models/person_connection.rb, app/models/session.rb, app/views/layouts/_logged_in.haml, app/views/people/new.haml, app/views/sessions/_new.haml, features/step_definitions/user_steps.rb, spec/controllers/api/badges_controller_spec.rb, spec/controllers/api/comments_controller_spec.rb, spec/controllers/api/conversations_controller_spec.rb, spec/controllers/api/devices_controller_spec.rb, spec/controllers/api/listings_controller_spec.rb, spec/controllers/api/testimonials_controller_spec.rb, spec/controllers/api/tokens_controller_spec.rb, spec/controllers/people_controller_spec.rb, spec/controllers/sessions_controller_spec.rb, spec/factories.rb, spec/helpers/rest_helper_spec.rb, spec/models/person_spec.rb, spec/models/session_spec.rb, test/helper_modules.rb, vendor/plugins/np_guid/lib/uuidtools.rb, app/controllers/sms_controller.rb, app/views/homepage/_recent_listing.haml, spec/helpers/sms_helper_spec.rb, spec/models/community_spec.rb, spec/models/ressi_event_spec.rb]","[app/controllers/application_controller.rb, app/controllers/dashboard_controller.rb, app/models/community.rb, app/models/community_membership.rb, app/models/person.rb, app/views/communities/_select_pricing_plan.haml, app/views/dashboard/_footer.haml, app/views/dashboard/_header.haml, app/views/dashboard/_lower_middle.haml, app/views/dashboard/api.haml, app/views/dashboard/faq.haml, app/views/dashboard/index.haml, app/views/dashboard/pricing.haml]","[app/helpers/application_helper.rb, app/models/person.rb, app/views/layouts/application.haml, db/schema.rb]"
https://github.com/sharetribe/sharetribe,2808,"[app/controllers/communities_controller.rb, app/models/person.rb, features/communities/user_creates_a_new_community.feature, features/sessions/facebook_connect.feature, features/support/omniauth.rb, app/views/people/new.haml, config/locales/en.yml, config/locales/fi.yml, features/people/user_creates_a_new_account.feature, spec/fixtures/communities.yml, app/controllers/admin/feedbacks_controller.rb, app/helpers/application_helper.rb, app/views/layouts/application.haml]","[app/controllers/api/people_controller.rb, app/controllers/application_controller.rb, app/controllers/dashboard_controller.rb, app/controllers/people_controller.rb, app/controllers/sessions_controller.rb, app/helpers/application_helper.rb, app/models/asi_person.rb, app/models/community.rb, app/models/community_membership.rb, app/models/person.rb, app/views/communities/_select_pricing_plan.haml, app/views/dashboard/_footer.haml, app/views/dashboard/_header.haml, app/views/dashboard/_lower_middle.haml, app/views/dashboard/api.haml, app/views/dashboard/faq.haml, app/views/dashboard/index.haml, app/views/dashboard/pricing.haml, app/views/people/_help_texts.haml, app/views/people/new.haml, app/views/sessions/_new.haml, app/views/sessions/new.haml]",[features/people/user_creates_a_new_account.feature]
https://github.com/sharetribe/sharetribe,2829,"[app/helpers/people_helper.rb, app/views/people/show.haml, app/views/testimonials/_testimonial.haml, app/views/testimonials/index.haml, features/people/user_views_profile_page.feature, features/step_definitions/testimonial_steps.rb, features/support/paths.rb, features/testimonials/user_views_testimonials.feature, app/controllers/listings_controller.rb, app/helpers/application_helper.rb, app/views/communities/_new_tribe_form.haml, app/views/listings/_googlemap.haml, app/views/listings/_listings_on_map.haml, app/views/listings/form/_googlemap.haml, app/views/people/_googlemap.haml, app/views/settings/profile.haml, public/javascripts/googlemaps.js]","[app/controllers/application_controller.rb, app/controllers/dashboard_controller.rb, app/controllers/sessions_controller.rb, app/helpers/application_helper.rb, app/models/community.rb, app/models/community_membership.rb, app/models/conversation.rb, app/models/listing.rb, app/models/person.rb, app/models/testimonial.rb, app/views/communities/_select_pricing_plan.haml, app/views/dashboard/_footer.haml, app/views/dashboard/_header.haml, app/views/dashboard/_lower_middle.haml, app/views/dashboard/api.haml, app/views/dashboard/faq.haml, app/views/dashboard/index.haml, app/views/dashboard/pricing.haml, app/views/sessions/_new.haml, app/views/sessions/new.haml]","[app/stylesheets/style.scss, config/locales/fi.yml, public/stylesheets/compiled/style.css]"
https://github.com/sharetribe/sharetribe,2832,"[features/testimonials/user_views_testimonials.feature, app/helpers/badges_helper.rb, app/helpers/people_helper.rb, app/models/person.rb, app/stylesheets/style.scss, app/views/conversations/_message.haml, app/views/conversations/_received_conversation.haml, app/views/conversations/_sent_conversation.haml, app/views/listings/_comment.haml, app/views/listings/_help_texts.haml, app/views/listings/show.haml, app/views/people/_badge_description.haml, app/views/people/_profile_feedback.haml, app/views/people/show.haml, app/views/testimonials/_testimonial.haml, app/views/testimonials/index.haml, config/locales/en.yml, config/locales/fi.yml, db/migrate/20120704072606_edit_community_defaults.rb, db/schema.rb, features/badges/user_views_badges.feature, features/news_items/user_views_news_items.feature, features/people/user_views_profile_page.feature, public/javascripts/kassi.js, public/javascripts/kassi_dashboard.js, public/javascripts/sharetribe_common.js, public/stylesheets/compiled/style.css, public/stylesheets/uniform.kassi.css, spec/fixtures/communities.yml, features/settings/user_updates_profile_information.feature, app/helpers/application_helper.rb, communities/urv/logo_text/logo_text.haml, app/views/conversations/show.haml, app/views/layouts/_notifications.haml, app/views/layouts/application.haml, app/views/layouts/private.haml, app/views/listings/_comment_form.haml, app/views/homepage/_invitation_form.haml, app/views/homepage/index.haml, app/views/invitations/create.js.erb, features/invitations/user_invites_another_user.feature, public/javascripts/jquery.form.js]","[app/controllers/application_controller.rb, app/controllers/conversations_controller.rb, app/controllers/dashboard_controller.rb, app/controllers/homepage_controller.rb, app/controllers/listings_controller.rb, app/controllers/people_controller.rb, app/controllers/sessions_controller.rb, app/helpers/application_helper.rb, app/models/community.rb, app/models/community_membership.rb, app/models/conversation.rb, app/models/listing.rb, app/models/news_item.rb, app/models/person.rb, app/models/testimonial.rb, app/views/common/_staples.haml, app/views/communities/_select_pricing_plan.haml, app/views/conversations/_additional_messages.haml, app/views/conversations/_additional_notifications.haml, app/views/conversations/_inbox_spacer.haml, app/views/conversations/_message.haml, app/views/conversations/_notification.haml, app/views/conversations/_received_conversation.haml, app/views/conversations/_sent_conversation.haml, app/views/conversations/_status.haml, app/views/conversations/_status_link.haml, app/views/conversations/index.haml, app/views/conversations/new.haml, app/views/conversations/notifications.haml, app/views/conversations/notifications/_badgenotification.haml, app/views/conversations/notifications/_comment_to_followed_listing_notification.haml, app/views/conversations/notifications/_comment_to_own_listing_notification.haml, app/views/conversations/notifications/_listing_updated_notification.haml, app/views/conversations/notifications/_testimonialnotification.haml, app/views/conversations/show.haml, app/views/dashboard/_footer.haml, app/views/dashboard/_header.haml, app/views/dashboard/_lower_middle.haml, app/views/dashboard/api.haml, app/views/dashboard/faq.haml, app/views/dashboard/index.haml, app/views/dashboard/pricing.haml, app/views/homepage/_additional_private_listings_slate.haml, app/views/homepage/_blank_slate.haml, app/views/homepage/_event_feed.haml, app/views/homepage/_event_feed_event.haml, app/views/homepage/_invitation_form.haml, app/views/homepage/_news_item.haml, app/views/homepage/_news_items.haml, app/views/homepage/_poll_form.haml, app/views/homepage/_profile_info_empty_notification.haml, app/views/homepage/_recent_listing.haml, app/views/homepage/index.haml, app/views/listings/_additional_listings.haml, app/views/listings/_bubble_listing_not_visible.haml, app/views/listings/_comment.haml, app/views/listings/_comment_form.haml, app/views/listings/_destination.haml, app/views/listings/_edit_links.haml, app/views/listings/_follow_links.haml, app/views/listings/_googlemap.haml, app/views/listings/_help_texts.haml, app/views/listings/_left_panel_link.haml, app/views/listings/_listed_listing.haml, app/views/listings/_listed_listing_closed_status.haml, app/views/listings/_listed_listing_edit_links.haml, app/views/listings/_listed_listings.haml, app/views/listings/_listing_spacer.haml, app/views/listings/_listings_on_map.haml, app/views/listings/_origin.haml, app/views/listings/_reply_link.haml, app/views/listings/edit.haml, app/views/listings/form/_departure_time.haml, app/views/listings/form/_departure_time_radio_buttons.haml, app/views/listings/form/_description.haml, app/views/listings/form/_destination.haml, app/views/listings/form/_form_content.haml, app/views/listings/form/_googlemap.haml, app/views/listings/form/_images.haml, app/views/listings/form/_javascripts.haml, app/views/listings/form/_location.haml, app/views/listings/form/_origin.haml, app/views/listings/form/_send_button.haml, app/views/listings/form/_share_type.haml, app/views/listings/form/_tag_list.haml, app/views/listings/form/_title.haml, app/views/listings/form/_valid_until.haml, app/views/listings/form/_valid_until_radio_buttons.haml, app/views/listings/form/_visibility.haml, app/views/listings/index.haml, app/views/listings/new.haml, app/views/listings/show.haml, app/views/people/_help_texts.haml, app/views/people/new.haml, app/views/sessions/_new.haml, app/views/sessions/new.haml]","[app/controllers/conversations_controller.rb, app/stylesheets/style.scss, config/locales/fi.yml]"
https://github.com/sharetribe/sharetribe,2857,"[spec/controllers/people_controller_spec.rb, spec/models/person_spec.rb, test/helper_modules.rb, Gemfile.lock, app/helpers/application_helper.rb, app/models/person.rb, spec/factories.rb, spec/helpers/locations_helper_spec.rb, spec/models/cached_ressi_event_spec.rb, spec/models/ressi_event_spec.rb, spec/models/testimonial_spec.rb, app/controllers/sessions_controller.rb, config/locales/devise.es-ES.yml, config/locales/devise.es.yml, config/locales/devise.ca.yml, config/locales/devise.fr.yml, config/locales/devise.it.yml, config/locales/devise.nl.yml, config/locales/devise.ru.yml, config/locales/devise.zh.yml, app/controllers/people_controller.rb, public/javascripts/kassi.js, app/views/devise/mailer/confirmation_instructions.haml, app/views/devise/mailer/reset_password_instructions.haml, app/views/devise/mailer/reset_password_instructions.html.erb, app/views/devise/passwords/edit.haml, app/views/devise/passwords/edit.html.erb, config/locales/devise.en.yml, config/locales/devise.fi.yml, config/locales/en.yml, config/locales/fi.yml, app/controllers/confirmations_controller.rb, public/images/medium/missing.png, public/images/thumb/missing.png, app/controllers/terms_controller.rb, app/views/sessions/_password_forgotten.haml, config/routes.rb, app/views/devise/mailer/confirmation_instructions.html.haml, app/controllers/settings_controller.rb, app/views/settings/profile.haml, app/controllers/application_controller.rb, app/models/asi_person.rb, app/models/invitation.rb, features/listings/user_creates_a_new_listing.feature, features/listings/user_edits_his_own_listing.feature, features/step_definitions/user_steps.rb, spec/controllers/sessions_controller_spec.rb, spec/models/invitation_spec.rb, spec/spec_helper.rb, config/initializers/devise.rb, app/controllers/listings_controller.rb, lib/console scripts/userdata_from_asi.rb, Gemfile, app/views/layouts/application.haml, app/views/people/new.haml, app/views/sessions/new.haml, vendor/plugins/np_guid/init.rb, vendor/plugins/np_guid/lib/usesnpguid.rb, vendor/plugins/np_guid/lib/uuid22.rb, vendor/plugins/np_guid/lib/uuidtools.rb, db/migrate/20110914080549_add_devise_without_confirmable_to_people.rb, db/migrate/20110915084232_add_devise_to_people.rb, db/schema.rb, config/config.example.yml, lib/devise/encryptors/asi.rb, app/views/devise/registrations/new.html.erb, app/views/devise/sessions/new.html.erb, vendor/plugins/guid/init.rb, vendor/plugins/guid/lib/usesguid.rb, vendor/plugins/guid/lib/uuid22.rb, vendor/plugins/guid/lib/uuidtools.rb, lib/tasks/kassi.rake, app/views/settings/avatar.haml, db/migrate/20120104224115_add_phone_number_and_description_to_people.rb, db/migrate/20120105162140_add_attachment_image_to_people.rb, db/migrate/20110914115824_add_profile_attributes_to_people.rb, config/environments/development.rb, db/migrate/20110914080549_add_devise_to_people.rb]","[app/controllers/conversations_controller.rb, app/controllers/homepage_controller.rb, app/controllers/listings_controller.rb, app/controllers/people_controller.rb, app/controllers/sessions_controller.rb, app/helpers/application_helper.rb, app/models/community.rb, app/models/community_membership.rb, app/models/conversation.rb, app/models/listing.rb, app/models/person.rb, app/views/common/_staples.haml, app/views/conversations/_additional_messages.haml, app/views/conversations/_additional_notifications.haml, app/views/conversations/_inbox_spacer.haml, app/views/conversations/_message.haml, app/views/conversations/_notification.haml, app/views/conversations/_received_conversation.haml, app/views/conversations/_sent_conversation.haml, app/views/conversations/_status.haml, app/views/conversations/_status_link.haml, app/views/conversations/index.haml, app/views/conversations/new.haml, app/views/conversations/notifications.haml, app/views/conversations/notifications/_badgenotification.haml, app/views/conversations/notifications/_comment_to_followed_listing_notification.haml, app/views/conversations/notifications/_comment_to_own_listing_notification.haml, app/views/conversations/notifications/_listing_updated_notification.haml, app/views/conversations/notifications/_testimonialnotification.haml, app/views/conversations/show.haml, app/views/homepage/_additional_private_listings_slate.haml, app/views/homepage/_blank_slate.haml, app/views/homepage/_invitation_form.haml, app/views/homepage/_profile_info_empty_notification.haml, app/views/homepage/_recent_listing.haml, app/views/homepage/index.haml, app/views/listings/_additional_listings.haml, app/views/listings/_bubble_listing_not_visible.haml, app/views/listings/_comment.haml, app/views/listings/_comment_form.haml, app/views/listings/_destination.haml, app/views/listings/_edit_links.haml, app/views/listings/_follow_links.haml, app/views/listings/_googlemap.haml, app/views/listings/_help_texts.haml, app/views/listings/_left_panel_link.haml, app/views/listings/_listed_listing.haml, app/views/listings/_listed_listing_closed_status.haml, app/views/listings/_listed_listing_edit_links.haml, app/views/listings/_listed_listings.haml, app/views/listings/_listing_spacer.haml, app/views/listings/_listings_on_map.haml, app/views/listings/_origin.haml, app/views/listings/_reply_link.haml, app/views/listings/edit.haml, app/views/listings/form/_departure_time.haml, app/views/listings/form/_departure_time_radio_buttons.haml, app/views/listings/form/_description.haml, app/views/listings/form/_destination.haml, app/views/listings/form/_form_content.haml, app/views/listings/form/_googlemap.haml, app/views/listings/form/_images.haml, app/views/listings/form/_javascripts.haml, app/views/listings/form/_location.haml, app/views/listings/form/_origin.haml, app/views/listings/form/_send_button.haml, app/views/listings/form/_share_type.haml, app/views/listings/form/_tag_list.haml, app/views/listings/form/_title.haml, app/views/listings/form/_valid_until.haml, app/views/listings/form/_valid_until_radio_buttons.haml, app/views/listings/form/_visibility.haml, app/views/listings/index.haml, app/views/listings/new.haml, app/views/listings/show.haml, app/views/people/_help_texts.haml, app/views/people/new.haml, app/views/sessions/new.haml]","[app/models/listing.rb, config/locales/fi.yml, public/javascripts/kassi.js]"
